,keyword,rank,title,snippet,url,domain,total_results,latency,location,language,domain_popularity
329,AI Promotion,13,"Samsung Malaysia | Smartphones, TVs, Home Appliances","Without this product, applied coupon or promotion code cannot be redeemed. ... Pre-order and save up to RM1,800*. Bespoke AI. Buy now · Sale. Get ...",https://www.samsung.com/my/?srsltid=AfmBOorh7xCek9jFTWKd5ijXjFnK0yQLMOn_cSzP0hyBTBWmVNeMfZl3,www.samsung.com,155,2.14,us,en,2
330,AI Promotion,14,PayPal Stock Launches Checkout Sweepstakes Promotion ...,"Follow Reinhardt Krause on X, formerly Twitter, @reinhardtk_tech for updates on artificial intelligence, cybersecurity and cloud computing. YOU ...",https://www.investors.com/news/technology/paypal-stock-promotion-ferrell-affirm-stock/,www.investors.com,155,2.14,us,en,1
331,AI Promotion,15,Motion Graphics Promo Video for AI Product | Lovo AI,Burnwe has created a motion graphics promo video for our partner company Lovo AI. About promo videos ✓ These videos are the shortest and the ...,https://www.youtube.com/watch?v=6N_Tqc8Y7AA,www.youtube.com,155,2.14,us,en,172
332,AI Promotion,16,Want A Promotion? Improve These Emotional Intelligence ...,AI · Big Data · Cloud · Cloud 100 · Consumer Tech · Creator Economy ... Want A Promotion? Improve These Emotional Intelligence Skills. ByDr ...,https://www.forbes.com/sites/cynthiayoung/2025/04/12/want-a-promotion-improve-these-emotional-intelligence-skills/,www.forbes.com,155,2.14,us,en,2
333,AI Promotion,17,Venice | Private and Uncensored AI,"Try Venice.ai for free. Generate text, images, characters and code using private and uncensored AI.",https://venice.ai/,venice.ai,155,2.14,us,en,1
334,AI Promotion,18,AI Regulation and Building Trust in Responsible AI,Protecting Consumers and Promoting Innovation – AI Regulation and Building Trust in Responsible AI. by Nicole Foster on 01 DEC 2022 in Amazon Machine ...,https://aws.amazon.com/blogs/machine-learning/protecting-consumers-and-promoting-innovation-ai-regulation-and-building-trust-in-responsible-ai/,aws.amazon.com,155,2.14,us,en,2
335,AI Promotion,19,Namecheap Promo Codes (Up to 80% Off) - April 2025,Save up to 80% with these current Namecheap coupons for April 2025. The latest namecheap.com coupon codes at CouponFollow.,https://couponfollow.com/site/namecheap.com,couponfollow.com,155,2.14,us,en,2
336,AI Promotion,20,AI ENGLISH 🤖 | PAID promotion available Daily learn english ...,"9 likes, 0 comments - fast_english_spoken on April 12, 2025: ""PAID promotion available Daily learn english..... #learnenglish #short #reels ...",https://www.instagram.com/reel/DIX0Z09q9BF/,www.instagram.com,155,2.14,us,en,8
337,AI Promotion,21,Silicon Valley stifled the AI doom movement in 2024,"in 2024, those warning calls were drowned out by a practical and prosperous vision of generative AI promoted by the tech industry — a vision ...",https://techcrunch.com/2025/01/01/2024-the-year-silicon-valley-stifled-the-ai-doom-movement/,techcrunch.com,155,2.14,us,en,1
338,AI Promotion,22,Midjourney Promo Codes - $200 Off Discount Code April ...,"Step into the world of AI-generated art with Midjourney, now offering an array of savings opportunities on Dealspotr. Capitalize on our promo codes, ...",https://dealspotr.com/promo-codes/midjourney.com,dealspotr.com,155,2.14,us,en,2
339,AI Promotion,23,AI Product Promotion: From Photo to Viral Video Learn how AI ...,AI Product Promotion: From Photo to Viral Video Learn how AI transforms product promotion! See how a simple phone photo becomes a stunning ...,https://www.youtube.com/watch?v=s9u3ncZjrwQ,www.youtube.com,155,2.14,us,en,172
340,AI Promotion,24,𝐃𝐌 𝐅𝐎𝐑 𝐒𝐇𝐎𝐔𝐓𝐎𝐔𝐓 /𝐏𝐑𝐎𝐌𝐎𝐓𝐈𝐎𝐍 | CREDIT GOES TO ...,"12K likes, 1 comments - ai._.art._.world on April 13, 2025: ""CREDIT GOES TO AMAZING PROFILE @anyanovak__"".",https://www.instagram.com/p/DIYY2-Wotkc/,www.instagram.com,155,2.14,us,en,8
341,AI Promotion,25,How to Get Your Next Promotion Using AI,"... Promotions with AI – Unlock Your Career Growth! Are you tired of waiting for that well-deserved promotion? In today's fast-paced world, AI ...",https://www.youtube.com/watch?v=aTNBTFBM6so,www.youtube.com,155,2.14,us,en,172
342,AI Promotion,26,Teaching in The Age of AI promo,Teaching in The Age of AI promo. 2 views · 3 hours ago ...more. Starlink Professional Development. 356. Subscribe. 0. Share. Save.,https://www.youtube.com/watch?v=5ZTXKhwBEJw,www.youtube.com,155,2.14,us,en,172
343,AI Promotion,27,Peter Shoukry | Promo video for my book coming to life: “Look ...,"... AI software. Author: @petershoukry Copyright©️2025, All rights ... Promo video for my book coming to life: “Look Behind The Fifth ...",https://www.instagram.com/reel/DIVVtx0R29w/,www.instagram.com,155,2.14,us,en,8
344,AI Promotion,28,How Beyond is reimagining its promo strategy with behavioral AI,Beyond Inc. faced a growing challenge—balancing competitive discounting with profitability. By leveraging AI to predict likelihood to ...,https://www.youtube.com/watch?v=5PTbkotd8yI,www.youtube.com,155,2.14,us,en,172
345,AI Promotion,29,"AI's Impact on Marketing: Faster, Better, & Smarter Strategies","In this episode of the AI-Driven Marketer, Dan Sanchez shares an enlightening interview with Brooks Lockett, diving deep into the ...",https://www.youtube.com/watch?v=iPMO4mT-GGY,www.youtube.com,155,2.14,us,en,172
346,AI Promotion,30,Optimize your promotions with AI,... AI #Innovation #Promotions #Optimization #DecisionMaking #Retail. ... Optimize your promotions with AI. 17 views · 8 months ago #AI #Retail ...,https://www.youtube.com/watch?v=cR4gvosLf78,www.youtube.com,155,2.14,us,en,172
347,AI Promotion,31,Chaser Trump book promotion : r/VaushV,pro ai · r/VaushV icon. r/VaushV. • 2 days ago. pro ai · r/VaushV - pro ai. 460 upvotes · 25 comments. Oh we are about to die… like actually die.,https://www.reddit.com/r/VaushV/comments/1jz0azf/chaser_trump_book_promotion/,www.reddit.com,155,2.14,us,en,4
348,AI Promotion,32,Amazon Promo Codes & Daily Deals: Save 20-80% Now,"Unlock incredible savings with our exclusive Amazon promo codes and best Amazon deals presented daily ... AI Language Translation Earbuds, Bluetooth 5.4 ...",https://www.koupon.ai/,www.koupon.ai,155,2.14,us,en,1
349,AI Promotion,33,How AI & Data Are Revolutionizing Promotional Products ...,How AI & Data Are Revolutionizing Promotional Products | Insights from Our CEO | Promo Direct. No views · 8 minutes ago UNITED STATES ...more ...,https://www.youtube.com/watch?v=wqu1dpbMRNo,www.youtube.com,155,2.14,us,en,172
350,AI Promotion,34,Pastor Behind Weed-Themed Easter Promo Blasts Critics ...,"They are prime candidates for the anti-christ and one world, virtual AI religion. It takes the calamities of the Great Tribulation to ...",https://protestia.com/2025/04/13/pastor-behind-weed-themed-easter-promo-blasts-critics-in-sunday-sermon-we-dont-engage-with-religious-aholes/,protestia.com,155,2.14,us,en,1
351,AI Promotion,35,The AI Revolution in Marketing Is Just Beginning,"Did you know that 86% of junior and midlevel marketers already use AI at work each week? What are the top use cases for AI in marketing, ...",https://www.youtube.com/watch?v=SFc7yRwWlsI,www.youtube.com,155,2.14,us,en,172
352,AI Promotion,36,AI for Promo Industry Professionals - eBook Review,AI for the Promo Industry: How to Get Started & Grow Your Business Free eBook Download - https://merchbots.com/ai-for-promo-professionals/ ...,https://www.youtube.com/watch?v=AVh43eCrM_Q,www.youtube.com,155,2.14,us,en,172
353,AI Promotion,37,"LoveDeals: AI-Powered Coupons, Promo Codes, Deals, Cash ...","LoveDeals is an online platform that helps shoppers find coupon codes and discounts of online stores. It has an official website, lovedeals.ai, along with ...",https://lovedeals.ai/,lovedeals.ai,155,2.14,us,en,1
354,AI Promotion,38,Simplify AI for Non Tech Leaders Promo Clip,"If you found this content useful and would like to support the channel, you can buy me a coffee: https://www.buymeacoffee.com/LightsOnData ...",https://www.youtube.com/watch?v=mfcEqY27hTY,www.youtube.com,155,2.14,us,en,172
355,AI Promotion,39,Practical Strategies to Radically Optimize Pricing and ...,- Simple pricing and promotion techniques that are easy to implement now to expand margins and win with shoppers. - How ... promotions-ai/,https://www.youtube.com/watch?v=42lrKWC-K04,www.youtube.com,155,2.14,us,en,172
356,AI Promotion,40,BETBOOM TEAM | AI PROMO | ESL ONE RALEIGH,"Мы исследуем, как технологии AI помогают командам готовиться к ... BETBOOM TEAM | AI PROMO | ESL ONE RALEIGH. 17K views · 6 days ago",https://www.youtube.com/watch?v=9-gwrdruVYI,www.youtube.com,155,2.14,us,en,172
357,AI Promotion,41,Why You Shouldn't Skip This AI in Marketing Session,"In this must-watch session for marketers and eCommerce experts, Lara Jakob from MAPP explains how AI can dramatically enhance your marketing ...",https://www.youtube.com/watch?v=iHXL_YQSFyY,www.youtube.com,155,2.14,us,en,172
358,AI Promotion,42,Episode 8: AI-Powered Marketing – How to Get More Views & ...,... AI tools for YouTube marketing and promotion How to optimize your content for maximum views Tips for automating your social media ...,https://www.youtube.com/watch?v=GVB269PbEqs,www.youtube.com,155,2.14,us,en,172
359,AI Promotion,43,AI Promo,Open App. This content isn't available. AI Promo. 30 views · 11 months ago ...more. Computer Sciences Dept. - University of Technology. 738.,https://www.youtube.com/watch?v=GVuAjdQt_Dk,www.youtube.com,155,2.14,us,en,172
360,AI Promotion,44,BEWARE of Scam Promo Codes | New 7 Star iBom and ...,"... ai, MCOC 60FPS, Cyclops Buff, Genesis, Coda, etc SECOND CHANNEL ▷ https://www.youtube.com/channel/UCWmsTCJQNwmqao3lyNzHz1A 2025 Goal ...",https://www.youtube.com/watch?v=kQ6DZVFNO6Y,www.youtube.com,155,2.14,us,en,172
361,AI Promotion,45,Get the BEST Promo Videos Using AI in Just 3 Steps,... promotional videos that capture attention and drive engagement. And that's just the beginning! With over 20 powerful AI tools—including an AI ...,https://www.youtube.com/watch?v=R6CGLwKPvzI,www.youtube.com,155,2.14,us,en,172
362,AI Promotion,46,Promote Your Product With Aha AI Agent,"Promote Your Product With Aha AI Agent! Want to boost your product promotions effortlessly? Meet Aha AI Agent, the powerful AI tool that ...",https://www.youtube.com/watch?v=Ek92JVlA_hA,www.youtube.com,155,2.14,us,en,172
363,AI Promotion,47,Latest AI Marketing Stocks to Watch Now | Top AI Tech Stock ...,"Latest AI Marketing Stocks to Watch Now | Top AI Tech Stock News Today | BrandPilot AI | BPAI Welcome to McNallie Money, your daily dose of ...",https://www.youtube.com/watch?v=dU-uLj9FjV8,www.youtube.com,155,2.14,us,en,172
364,AI Promotion,48,Unlock Massive Profits: AI Marketing Secrets You Need to Know!,Unlock Massive Profits: AI Marketing Secrets You Need to Know! No views · 2 minutes ago #Shorts ...more. Ai Cashflow. 66. Subscribe.,https://www.youtube.com/watch?v=m_iOgIrhdog,www.youtube.com,155,2.14,us,en,172
365,AI Promotion,49,SHUT UPPPP! The Greatest Wrestling Promo of All Time ...,"... (AI Upscale footage) Zombie Thirteen (wrestling covers) ... The Greatest Wrestling Promo of All Time - David Arquette, WCW Monday Nitro #WCW # ...",https://www.youtube.com/watch?v=XQ-JGM61MLg,www.youtube.com,155,2.14,us,en,172
366,AI Promotion,50,AI Marketing Tools That Will Blow Your Mind in 2025!,... AI is a GAME-CHANGER) 0:25 - #1: AI Ad Tools (Create PERFECT ads in seconds) 0:55 - #2: AI Content Generators (Blogs/videos FAST) 1:25 - #3 ...,https://www.youtube.com/watch?v=EHIz7Tqs-YU,www.youtube.com,155,2.14,us,en,172
367,AI Promotion,51,PROMO AI Harmonies Album Modern Talking Style 2K25,PROMO AI Harmonies Album Modern Talking Style 2K25 ********************************************* **Attention:If you want to put our music on ...,https://www.youtube.com/watch?v=GIjUt0RHJ3k,www.youtube.com,155,2.14,us,en,172
368,AI Promotion,52,Unlock AI Marketing Secrets: Build Campaigns Even If You’re ...,"Discover how to create a powerful digital marketing campaign using AI, even if you're a complete beginner! In this video, we dive into the ...",https://www.youtube.com/watch?v=RbAu2qIuSJI,www.youtube.com,155,2.14,us,en,172
369,AI Promotion,53,AI Promo,This is a promo video informing viewers that DMS is now utilizing AI and also offering it as a services to clients.,https://www.youtube.com/watch?v=jyloOelcB8Q,www.youtube.com,155,2.14,us,en,172
370,AI Promotion,54,Top 10 High Ticket AI Offers to Promote in 2025: Earn $2000 ...,Top 10 High Ticket AI Offers to Promote in 2025: Earn $2000+ Per Sale | High Ticket Ai Offers 2025. 7 views · 20 minutes ago UNITED STATES,https://www.youtube.com/watch?v=5p3dkSZbBps,www.youtube.com,155,2.14,us,en,172
371,AI Promotion,55,AI-Powered Marketing: The Future is Here,"In this webinar, we'll cover: AI-powered marketing and its potential impact on the industry. Chatbots and how they are changing the way ...",https://www.youtube.com/watch?v=d5_-UJesrtI,www.youtube.com,155,2.14,us,en,172
372,AI Promotion,56,AI Master review | Demo | Bundle | Huge Bonus | Discount ...,Click here to check the AI Master – Mastering AI for Digital Marketing: https://hudareview.com/yt/ai-master --- Don't miss my full AI ...,https://www.youtube.com/watch?v=D8PbtOYIgA4,www.youtube.com,155,2.14,us,en,172
373,AI Promotion,57,Unlock AI's Power in Marketing,"This video shares with you the importance of using AI in marketing, and how productive it can make you. Leaving you time to concentrate on ...",https://www.youtube.com/watch?v=t2Y1v6HFPP0,www.youtube.com,155,2.14,us,en,172
374,AI Copy Generator,1,Free AI Writing Generator & Tools,"Free AI-powered writing generators. No more writer's block. Share your ideas, hit a button, and watch as our AI writing tools generate the copy you need.",https://www.copy.ai/tools,www.copy.ai,438000000,7.17,us,en,3
375,AI Copy Generator,2,Magic Write: AI Text Generator & AI Writer,"Magic Write™, powered by OpenAI, is your very own AI text generator to help you get out a first draft, fast. Simply start with a prompt and watch as copy, blog ...",https://www.canva.com/magic-write/,www.canva.com,438000000,7.17,us,en,3
376,AI Copy Generator,3,The 6 best AI writing generators,The 6 best AI writing generators · Jasper · Anyword · Writer · Writesonic · Rytr · Sudowrite ...,https://zapier.com/blog/best-ai-writing-generator/,zapier.com,438000000,7.17,us,en,3
377,AI Copy Generator,4,Free AI Text Generator - No Login Required,"The AI Text Generator is a free tool powered by Semrush. Use it to create original content: blogs, ads, emails, paragraphs, social posts, and more.",https://www.semrush.com/contentshake/ai-text-generator/,www.semrush.com,438000000,7.17,us,en,3
378,AI Copy Generator,5,Free AI Writing Tools,"Create professional website content in minutes with our free AI Website Copy Generator. Simply provide your webpage topic, and our tool generates AI-powered ...",https://ahrefs.com/writing-tools,ahrefs.com,438000000,7.17,us,en,2
379,AI Copy Generator,6,Free AI Writer - Text Generator & AI Copywriting Assistant,"Generate 80+ types of copy in seconds with the AI Writer. Write unique & plagiarism-free content for blogs, articles, ads, products, websites & social media.",https://simplified.com/ai-writer,simplified.com,438000000,7.17,us,en,3
380,AI Copy Generator,7,"AI Content & Copy Generator (FREE, No Signup)",How Content & Copy Generator Works. Our tool harnesses advanced AI algorithms to create high-quality content and marketing copy tailored to your brand's voice.,https://logicballs.com/tools/ai-writing-and-copy-generator,logicballs.com,438000000,7.17,us,en,1
381,AI Copy Generator,8,"Free AI Writing Tools - No Sign-Up, No Limit",AI Write · Essay Writer · Content Improver · Paragraph Writer · Paragraph Completer · Story Generator · Grammar Fixer · Content Summarizer · Sentence Rewriter.,https://tinywow.com/tools/write,tinywow.com,438000000,7.17,us,en,1
382,AI Copy Generator,9,"[FREE] AI Text Generator (No Sign-Up, Unlimited)","This AI writer tool is a completely free alternative for generating text, blog articles, scripts, or any paragraph you desire.",https://toolbaz.com/writer/ai-text-generator,toolbaz.com,438000000,7.17,us,en,2
383,AI Copy Generator,10,"Rytr: Free AI Writer, Content Generator & Writing Assistant","Discover Rytr, your free AI writing assistant. Craft high-quality content faster than ever before. Start for free and upgrade as you grow!",https://rytr.me/,rytr.me,438000000,7.17,us,en,1
384,AI Copy Generator,11,Copy.ai,"Introducing the first-ever GTM AI platform. Automate hundreds of tedious, repetitive tasks and empower your team to scale success like never before.",https://www.copy.ai/,www.copy.ai,438000000,7.17,us,en,3
385,AI Copy Generator,12,Copymatic: AI Copywriter & Content Writer,"Copymatic is a powerful AI-powered copywriter and content writer that lets you write digital ads, website copy or blog content, and more in seconds.",https://copymatic.ai/,copymatic.ai,438000000,7.17,us,en,1
386,AI Copy Generator,13,Free AI Copywriting Tools - Your Online Writing Assistant,"Our AI copywriting tool generates high-performing content in seconds - website copy, ads, social media posts - all tailored to your audience.",https://simplified.com/ai-copywriting,simplified.com,438000000,7.17,us,en,3
387,AI Copy Generator,14,Free AI Writer,"Go from blank page to a polished draft in seconds with Grammarly's free AI text generator. Create unique content for social media, blog posts, documents, ...",https://www.grammarly.com/ai-writer,www.grammarly.com,438000000,7.17,us,en,2
388,AI Copy Generator,15,Smart Copy - AI copywriting and content generator tool,"With Smart Copy you can instantly generate, remix, and expand content for all your campaigns needs—like landing pages, ads, and emails—in seconds.",https://unbounce.com/product/smart-copy/,unbounce.com,438000000,7.17,us,en,1
389,AI Copy Generator,16,AI Writer - 100% Free AI Text Generator | Quicktools by Picsart,"Generate premium quality copy for social media, marketing, advertising, and more with our AI Writer tool. 100% free | 16+ AI tools | Results in 5 seconds.",https://tools.picsart.com/text/ai-writer/,tools.picsart.com,438000000,7.17,us,en,1
390,AI Copy Generator,17,AI that's built for marketing – Jasper,"Jasper is the purpose-built generative AI platform for marketing. Built on a foundation of enterprise trust, Jasper deeply understands marketing.",https://www.jasper.ai/,www.jasper.ai,438000000,7.17,us,en,4
391,AI Copy Generator,18,Which AI Tool Writes the Best Marketing Copy? [I Tested ...,Anyword is a free AI copy generator that is pretty simple to use. All I needed to do was select the social media platform I wanted to post ...,https://blog.hubspot.com/marketing/copywriting-ai-tools,blog.hubspot.com,438000000,7.17,us,en,2
392,AI Copy Generator,19,AI Marketing Copy Generator To Create All Your Content,"Use our AI marketing copy generator to cut 70% of the time you spend on writing countless ad copies. Focus on marketing, not writing.",https://textcortex.com/templates/marketing-copy-generator,textcortex.com,438000000,7.17,us,en,1
393,AI Copy Generator,20,Free AI Writing & Text Generation Tools,"By understanding your context and preferred writing style, AI writing auto generates text, helping you work faster where you write the most.",https://www.grammarly.com/ai/ai-writing-tools,www.grammarly.com,438000000,7.17,us,en,2
394,AI Copy Generator,21,AI Ad Copy Generator: Create Compelling Ads in Seconds!,"Generate effective, SEO-friendly ads for your business. Our AI Ad Copy Generator creates powerful and engaging ads that convert customers in no time!",https://www.hypotenuse.ai/tools/ad-copy-generator,www.hypotenuse.ai,438000000,7.17,us,en,2
395,AI Copy Generator,22,[FREE] AI Copywriter | Create Engaging Content,Write quality content with the AI copywriter tool -Toolbaz. Generate engaging blog posts and web copy in seconds and go viral on social media.,https://toolbaz.com/writer/ai-copywriter,toolbaz.com,438000000,7.17,us,en,2
396,AI Copy Generator,23,Unlock Email Marketing Brilliance with Mailjet's AI Copy ...,Unlock the power of AI with Mailjet. Effortlessly generate email templates tailored to your brand voice and audience with the AI Template Generator.,https://www.mailjet.com/products/email-marketing/ai-email-generator/,www.mailjet.com,438000000,7.17,us,en,1
397,AI Copy Generator,24,"AI Agents for SEO, Content & GEO: Rank Higher | Writesonic","Most Advanced AI Article Writer. Generate factually accurate, SEO-optimized content that outperforms competitors using the most advanced AI writing tool.",https://writesonic.com/,writesonic.com,438000000,7.17,us,en,4
398,AI Copy Generator,25,"9 of the Best AI Writing Tools to Help You Work Smarter, ...",I've put dozens of AI writing tools to the test — here's a deep dive into my favorite AI writing generators and who I think they'll be most useful for.,https://buffer.com/resources/ai-writing-tools/,buffer.com,438000000,7.17,us,en,1
399,AI Copy Generator,26,Best AI Copywriting Tool Online,"Designs.ai is a powerful AI-powered copywriter tool that lets you write digital ads, website copy, and more in seconds.",https://designs.ai/copywriter,designs.ai,438000000,7.17,us,en,2
400,AI Copy Generator,27,AI Writer Makes Content Creation Simple and Quick,"Anyword is an AI writer that generates high-quality content and copy of all kinds, including long-form articles, blog posts, ad copy, social media posts, and ...",https://www.anyword.com/use-cases/ai-writer-tool,www.anyword.com,438000000,7.17,us,en,2
401,AI Copy Generator,28,The 11 Best AI Copywriting Tools (Free & Paid),These AI copywriting tools will help you work more efficiently and produce better marketing copy for any channel or medium.,https://www.wordstream.com/blog/ai-copywriting-tools,www.wordstream.com,438000000,7.17,us,en,2
402,AI Copy Generator,29,Freeadcopy,Introducing FreeAdCopy.com — The Only 100% FREE AI Copy-Generator That Will Outperform Even Your Best Ads (Seriously). Ready to outperform your current ads?,https://www.freeadcopy.com/,www.freeadcopy.com,438000000,7.17,us,en,1
403,AI Copy Generator,30,Easy Copy AI - Copy Generator Tool - Chrome Web Store,Get impressive and creative copy easily with EasyCopy.ai. Just click on 'Magic Copy' and generate your new copy. Works on all browsers! How to use EasyCopy.ai?,https://chromewebstore.google.com/detail/easy-copy-ai-copy-generat/gccfgfeoaicaleihkofhknklhcghommf?hl=en,chromewebstore.google.com,438000000,7.17,us,en,1
404,AI Copy Generator,31,Free AI Copywriting Tools,Use the world's advanced AI to generate marketing copy and blog posts. With NeuralText you write SEO content quickly and easily instead of spending hours on ...,https://neuraltext.com/tools,neuraltext.com,438000000,7.17,us,en,1
405,AI Copy Generator,32,AI Marketing Copy Generators [Free AI Copywriter],Improve your Marketing Copy with the help of AI. Generate Marketing Copy fast with the AI Copywriter. Start for free.,https://storylab.ai/marketing-copy-generators/,storylab.ai,438000000,7.17,us,en,2
406,AI Copy Generator,33,Free AI Google Ads Copy Generator,"This tool generates multiple variations of ad copy based on the given inputs, allowing marketers to experiment and test different messaging approaches. It helps ...",https://ahrefs.com/writing-tools/google-ads-generator,ahrefs.com,438000000,7.17,us,en,2
407,AI Copy Generator,34,"Writecream - Best AI Writer, Image, Audio & Content Generator ...","AI Article Writer. Generate blog articles and video scripts in minutes. Writing a 1,000+ word article in under 30 seconds.",https://www.writecream.com/,www.writecream.com,438000000,7.17,us,en,1
408,AI Copy Generator,35,AI Text Generator,"Try the AI text generator, a tool for content creation. It leverages a transformer-based Large Language Model (LLM) to produce text that follows the users ...",https://deepai.org/chat/text-generator,deepai.org,438000000,7.17,us,en,1
409,AI Copy Generator,36,AI Website Copy: How to Create Quality Content,Use generative AI on Squarespace to draft copy for your website based on a simple prompt. Then tweak to fit your voice and publish.,https://www.squarespace.com/blog/ai-website-copy-generator,www.squarespace.com,438000000,7.17,us,en,1
410,AI Copy Generator,37,Website Copy Generator,Simplify your landing page copy creation efforts with our AI-assisted about us page generator and website copy generator use cases.,https://writeme.ai/website-copy/,writeme.ai,438000000,7.17,us,en,1
411,AI Copy Generator,38,"Predis AI Ad Generator - AI to Make Ads, Videos in Seconds!","1 AI tool for Ads. Make Ad creatives, ad copies in all formats and languages. Drive clicks with our AI Ad Generator. Make social media, E-comm posts, ...",https://predis.ai/,predis.ai,438000000,7.17,us,en,1
412,AI Copy Generator,39,Website Copy and Landing Page Generator,Generate high-quality website copy for your landing page with our free landing page generator. Quickly create optimized website copy and convert more leads.,https://writesonic.com/website-landing-page-copy-generator,writesonic.com,438000000,7.17,us,en,4
413,AI Copy Generator,40,"5 Top AI Writing Generators: Features, Pricing, Pros & Cons","Jasper is an AI writing generator made especially for creating marketing copy. It comes with over 50 templates, which makes it a great tool for ...",https://backlinko.com/best-ai-content-generator-tools,backlinko.com,438000000,7.17,us,en,1
414,AI Copy Generator,41,Free AI Social Media Post Generator,Use SocialBee's FREE AI social media post generator to streamline your content creation process. Start your 14-day free trial now!,https://socialbee.com/ai-post-generator/,socialbee.com,438000000,7.17,us,en,1
