,keyword,rank,title,snippet,url,domain,total_results,latency,location,language,domain_popularity
163,AI marketing,66,How AI is Reshaping Marketing Forever,"Marketing just changed forever. Imagine having an AI-driven expert crafting your entire strategy-24/7, no guesswork, no wasted budget.",https://www.youtube.com/watch?v=HSdrveQgz4Q,www.youtube.com,3920000000,1.88,us,en,172
164,AI marketing,67,The Surprising Truth About AI Marketing Updates for Small ...,Discover the crucial role of artificial intelligence in shaping the marketing landscape and how AI tools are rapidly evolving to offer ...,https://www.youtube.com/watch?v=kDhzOwQchn4,www.youtube.com,3920000000,1.88,us,en,172
165,AI marketing,68,AI & The Future of Marketing | Preparing Your Marketing ...,"There´s no doubt about it - AI is the future of marketing. If your organization isn´t prepared, you might be left behind.",https://www.youtube.com/watch?v=VwAIh1fDDDQ,www.youtube.com,3920000000,1.88,us,en,172
166,AI marketing,69,AI Marketing Tools for Small Business Owners | AI Digital ...,AI Marketing Tools for Small Business Owners | AI Digital Marketing Tips by Vignes | Rank Strikers. 1 view · 3 minutes ago UNITED KINGDOM,https://www.youtube.com/watch?v=wZTzigqBmlI,www.youtube.com,3920000000,1.88,us,en,172
167,AI marketing,70,Your friendly guide in the world of AI-powered marketing,Welcome to AI Marketing Partner! Transform your business strategy into a universal language every AI understands. Follow for AI marketing ...,https://www.youtube.com/watch?v=vhCdVXZNPBg,www.youtube.com,3920000000,1.88,us,en,172
168,AI marketing,71,How to use AI TOOLS for Marketing,"How to use AI TOOLS for Marketing, How to use AI TOOLS for Marketing Using AI tools for marketing can significantly enhance your marketing ...",https://www.youtube.com/watch?v=UcVjKvEu9wA,www.youtube.com,3920000000,1.88,us,en,172
169,AI marketing,72,Unleash the Power of AI in Marketing: 5 Strategies to Boost ...,"Join Thomas Young as he explores actionable ways AI is transforming the marketing landscape, helping YOU supercharge your sales and dominate ...",https://www.youtube.com/watch?v=wQdV1JN5asY,www.youtube.com,3920000000,1.88,us,en,172
170,AI marketing,73,AI Marketing: Here's What You Need To Know!,The video warns about the dangers of over-reliance on AI in marketing practices.,https://www.youtube.com/watch?v=okh56B3yr_g,www.youtube.com,3920000000,1.88,us,en,172
171,AI marketing,74,"AI Marketing Hacks: More Engagement, More Sales!",Struggling with content creation and low conversions? AI has your back! Discover how Canva AI automates social media graphics and how ...,https://www.youtube.com/watch?v=uFJ91blkM1k,www.youtube.com,3920000000,1.88,us,en,172
172,AI marketing,75,What Is AI Marketing? Boost Conversions & ROI with Data ...,Website Link Below: https://get.instapage.com/wz14yi6b5p0z Discover what AI marketing is and how it can transform your advertising campaigns ...,https://www.youtube.com/watch?v=wFS52rR7CsQ,www.youtube.com,3920000000,1.88,us,en,172
173,AI marketing,76,The AI Marketing Revolution: Stay Ahead or Get Left Behind,"Welcome to the SalesEra Podcast – Your Go-To Source for Cutting-Edge Marketing Strategies! In this debut episode, host Andrea Valentina ...",https://www.youtube.com/watch?v=a1EMEmq4P-A,www.youtube.com,3920000000,1.88,us,en,172
174,AI marketing,77,Optimize Marketing and Sales using AI,In this short video we discuss how traditional sales and marketing techniques work when assisted by AI.,https://www.youtube.com/watch?v=7iGqhomIAMs,www.youtube.com,3920000000,1.88,us,en,172
175,AI marketing,78,The Future of AI In Marketing | AI Marketing,The Future of AI In Marketing | AI Marketing Want to learn how to generate leads easily? Check out our Effortless Revenue Mastermind: ...,https://www.youtube.com/watch?v=jNyBxfC0_XA,www.youtube.com,3920000000,1.88,us,en,172
176,AI marketing,79,The Million-Dollar AI Marketing Method Big Health Brands ...,Learn the 4-step framework helping health brands excel with AI-driven marketing strategies. Click the link and I'll help you build this ...,https://www.youtube.com/watch?v=Xs2HFNRSeF0,www.youtube.com,3920000000,1.88,us,en,172
177,AI marketing,80,I Spent $20 on an AI Marketing Agent – Here’s What I Learned!,Read the full article here: https://hwhx.net/article/i-paid-20-for-an-ai-marketing-agent-and-here-s-what-it-got-me Curious about AI ...,https://www.youtube.com/watch?v=Zj2jmQEq9sQ,www.youtube.com,3920000000,1.88,us,en,172
178,AI marketing,81,Maximize Your Marketing : The best AI Marketing Tools,Elevate Your Marketing & Sales to Power Up Your Business Today! ✓ Watch Marketingblocks demo https://bit.ly/3HR0qUD Ge 10% off with Promo ...,https://www.youtube.com/watch?v=4GCaJdMVuAU,www.youtube.com,3920000000,1.88,us,en,172
179,AI marketing,82,Revolutionizing Digital Marketing: How AI Transforms ...,Unlock the secrets of digital marketing with AI in our latest video! Discover how artificial intelligence is transforming the marketing ...,https://www.youtube.com/watch?v=z-0DZNE-lP8,www.youtube.com,3920000000,1.88,us,en,172
180,AI marketing,83,How to Use AI for Marketing – Marketing Trend Talks,"... AI. Marketers are hustling to learn how to use AI for marketing. As many brands have worked years to lay the proper foundation for AI, many ...",https://www.youtube.com/watch?v=8gapvVCaAOk,www.youtube.com,3920000000,1.88,us,en,172
181,AI marketing,84,Modern Marketing Tools: How Artificial Intelligence Can Help ...,"As a business owner, you know that marketing is essential to your success. But, what if there were tools out there that could help you with ...",https://www.youtube.com/watch?v=kMnvq6gFfm4,www.youtube.com,3920000000,1.88,us,en,172
182,AI marketing,85,Revolutionize Your Business: Start Fresh with AI Marketing,"Revolutionize Your Business: Start Fresh with AI Marketing Are you ready to take your business to the next level? In this video, we'll show ...",https://www.youtube.com/watch?v=Dyd5xH2etME,www.youtube.com,3920000000,1.88,us,en,172
183,AI marketing,86,AI marketing strategies that boost restaurant revenue with ...,AI is changing the restaurant marketing game in ways that can save you time while boosting your revenue. In this episode of The Pre-Shift ...,https://www.youtube.com/watch?v=lcgr4fAGhVM,www.youtube.com,3920000000,1.88,us,en,172
184,AI marketing,87,AI Marketing CAN’T BEAT Personal Touch,"Business is still based on real human relationships. It may sound counterintuitive, but personal and authentic-based marketing outreach ...",https://www.youtube.com/watch?v=VTjXDVqqkGI,www.youtube.com,3920000000,1.88,us,en,172
185,AI marketing,88,"""How AI Transforms Marketing to Target Customers with ...","Want to know how Artificial Intelligence (AI) is revolutionizing market analysis and customer targeting? In this video, we explore how AI ...",https://www.youtube.com/watch?v=AQ9C-yaue38,www.youtube.com,3920000000,1.88,us,en,172
186,AI marketing,89,AI Marketing Secrets That Made My Business 10X More ...,AI Marketing Secrets That Made My Business 10X More Profitable! No views · 59 minutes ago ...more. Green & Clean Professionals (Cybersimcoder)( ...,https://www.youtube.com/watch?v=KzEjtTiXMm8,www.youtube.com,3920000000,1.88,us,en,172
187,AI marketing,90,AI-Powered Marketing: 5 Game-Changing Strategies Revealed,Discover how AI is revolutionizing marketing with game-changing strategies that will transform your digital presence.,https://www.youtube.com/watch?v=sD9BFt11wBg,www.youtube.com,3920000000,1.88,us,en,172
188,AI marketing,91,The Future of Content Marketing Lies in AI,"I would very like to get a review from you. Please send a note to me. Thanks, Peter! like to much appreciate a review from you!! Thank you!",https://www.youtube.com/watch?v=GVvpZGAAMsc,www.youtube.com,3920000000,1.88,us,en,172
189,AI marketing,92,AI Digital Marketing is Taking Over! | The Future is Here 🚀,"Artificial intelligence, AI tools, and machine learning are completely transforming the world of digital marketing—and we're here for it!",https://www.youtube.com/watch?v=uIaDn9n1nMk,www.youtube.com,3920000000,1.88,us,en,172
190,AI marketing,93,TOP AI Marketing Tools Every Marketer Needs To Succeed,"MarketingBlocks: your all-in-one AI marketing Tool that empowers you to create captivating landing pages, stunning designs, promo videos, ...",https://www.youtube.com/watch?v=8U4IVnEaAaM,www.youtube.com,3920000000,1.88,us,en,172
191,AI marketing,94,Mastering AI in Marketing: Targeting Changes Engagement,"AI can ensure every customer interaction is highly relevant, not just high-volume. See the impact of AI-generated content that prioritizes ...",https://www.youtube.com/watch?v=l6RMTOKwdpI,www.youtube.com,3920000000,1.88,us,en,172
192,AI marketing,95,Unlocking AI: Marketing Secrets from Big Brands 🚀,Discover how the world's biggest brands are leveraging AI to revolutionize their marketing strategies.,https://www.youtube.com/watch?v=qhgsWI4ZYtM,www.youtube.com,3920000000,1.88,us,en,172
193,AI marketing,96,I Asked Grok AI For The Best Stocks To Buy During This ...,... AI for the best stocks to buy during the 2025 stock market crash and during the Trump Tariffs market crash. Are these the best AI stocks in ...,https://www.youtube.com/watch?v=LCDkwW1W83E,www.youtube.com,3920000000,1.88,us,en,172
194,AI marketing,97,AI in Business & Marketing How Artificial Intelligence is ...,"AI in Business & Marketing is changing the game! From automation to personalized marketing, AI is revolutionizing how businesses engage with ...",https://www.youtube.com/watch?v=ygKoK04iMD4,www.youtube.com,3920000000,1.88,us,en,172
195,AI marketing,98,Video Lecture: 21 Dawn of AI in Digital Marketing,Open App. This content isn't available. Video Lecture: 21 Dawn of AI in Digital Marketing. No views · 2 minutes ago ...more. NOU25 MA05. 96.,https://www.youtube.com/watch?v=vR5kmsElies,www.youtube.com,3920000000,1.88,us,en,172
196,AI marketing,99,AI Marketing Tools that Transform Marketing Today,AI marketing tools that transform marketing today. Discover the magic of AI marketing tools that are reshaping the way we promote our brands ...,https://www.youtube.com/watch?v=W8wSXfJbulE,www.youtube.com,3920000000,1.88,us,en,172
197,AI marketing,1,AI Marketing Tools that Transform Marketing Today,AI marketing tools that transform marketing today. Discover the magic of AI marketing tools that are reshaping the way we promote our brands ...,https://www.youtube.com/watch?v=W8wSXfJbulE,www.youtube.com,220,1.93,us,en,172
198,AI marketing,2,Explore the Power of AI in Marketing | AI-driven marketing ...,"... AI-driven marketing solutions and boost your business today, this offer ends soon! Explore the Power of AI in Marketing! AI-driven marketing ...",https://www.youtube.com/watch?v=98G7mzhfYWE,www.youtube.com,220,1.93,us,en,172
199,AI marketing,3,Friendly guide in the world of AI-powered marketing,Welcome to AI Marketing Partner! Transform your business strategy into a universal language every AI understands. Follow for AI marketing ...,https://www.youtube.com/watch?v=OcHXVPy2EXw,www.youtube.com,220,1.93,us,en,172
200,AI marketing,4,How to transform your marketing using AI,Ready to supercharge your marketing using AI? Join us for an interactive and insightful workshop designed specifically for small business ...,https://www.youtube.com/watch?v=J5Fp2JpxTGA,www.youtube.com,220,1.93,us,en,172
201,AI marketing,5,How Top Marketing Companies Use AI to Dominate,Top marketing companies are not just using AI—they're mastering it. From hyper-personalized experiences to predictive analytics and ...,https://www.youtube.com/watch?v=hZSUonngpu4,www.youtube.com,220,1.93,us,en,172
202,AI marketing,6,Using AI In Digital Marketing: How You Can Use AI ...,AI Marketing refers to the use of artificial intelligence technologies to enhance and automate various aspects of marketing activities.,https://www.youtube.com/watch?v=L1px4vMpovE,www.youtube.com,220,1.93,us,en,172
203,AI marketing,7,Unlock AI Marketing Secrets: Build Campaigns Even If You’re ...,"Discover how to create a powerful digital marketing campaign using AI, even if you're a complete beginner! In this video, we dive into the ...",https://www.youtube.com/watch?v=RbAu2qIuSJI,www.youtube.com,220,1.93,us,en,172
204,AI marketing,8,AI in Marketing: The Benefits & the Bull,"Is AI marketing and advertising genuinely game-changing, or just glorified hype? Join media planning and creative advertising veterans Leah ...",https://www.youtube.com/watch?v=yGuL4uLr_m0,www.youtube.com,220,1.93,us,en,172
205,AI marketing,9,AI: The Future of Marketing Strategies 💡,"In today's video, I share how AI helps me test campaigns faster and more effectively, optimizing results like never before!",https://www.youtube.com/watch?v=vutO0LzWkp8,www.youtube.com,220,1.93,us,en,172
206,AI marketing,10,Why Your Marketing Strategy Needs AI Right Now!,Why Your Marketing Strategy Needs AI Right Now! Experience how AI for business is reshaping the future of digital marketing through advanced ...,https://www.youtube.com/watch?v=bcFmyVLijTU,www.youtube.com,220,1.93,us,en,172
207,AI marketing,11,AI's Secret to Smarter Marketing Campaigns #shorts #AI,AI's Secret to Smarter Marketing Campaigns #shorts #AI #marketing #campaigns #AItools #customerpreferences #targetedstrategies #dataanalysis ...,https://www.youtube.com/watch?v=QxfJ-LNNhEo,www.youtube.com,220,1.93,us,en,172
208,AI marketing,12,Transform Your Marketing Strategy with AI,"Join me as I delve into how AI can revolutionize our marketing efforts, enhancing creativity while cutting costs.",https://www.youtube.com/watch?v=TrriHNRbUPc,www.youtube.com,220,1.93,us,en,172
209,AI marketing,13,Marketing Your AI Driven Solutions Part 5,Please visit our blog at https://powerleadsystem.org/marketing-your-ai-driven-solutions-part-5-of-7/ enjoy the article.,https://www.youtube.com/watch?v=Y2sVhPjNooQ,www.youtube.com,220,1.93,us,en,172
210,AI marketing,14,Unlock Massive Profits: AI Marketing Secrets You Need to Know!,Unlock Massive Profits: AI Marketing Secrets You Need to Know! No views · 2 minutes ago #Shorts ...more. Ai Cashflow. 66. Subscribe.,https://www.youtube.com/watch?v=m_iOgIrhdog,www.youtube.com,220,1.93,us,en,172
211,AI marketing,15,AI in Marketing,How are new trends in AI changing marketing? #AIMarketing #DigitalMarketing #Automation.,https://www.youtube.com/watch?v=PgYePCGtFpA,www.youtube.com,220,1.93,us,en,172
212,AI marketing,16,🤖 The Impact of AI on Digital Marketing 📈,The Impact of AI on Digital Marketing Description: AI is no longer the future—it's the NOW of digital marketing.,https://www.youtube.com/watch?v=-F5WdqSo_W8,www.youtube.com,220,1.93,us,en,172
213,AI marketing,17,Al Revolutionizing Digital Marketing | ai with digital marketing.,Al Revolutionizing Digital Marketing.In this video I will give you complete information about ai with digital marketing. digital marketing ...,https://www.youtube.com/watch?v=d7t5AlUUjv0,www.youtube.com,220,1.93,us,en,172
214,AI marketing,18,Get Ready For The AI-Powered Marketing Revolution (FREE!),OSNAP Active Lifestyle - https://www.OSNAPActiveLifestyle.com/aem Transform Your Marketing for FREE: Unlock the Power of AI!,https://www.youtube.com/watch?v=iUCoI4nv8vU,www.youtube.com,220,1.93,us,en,172
215,AI marketing,19,"AI Marketing: Transform Your Marketing, Content & Copywriting","https://marketpedia.ai - Marketpedia ai is an AI-powered SaaS platform designed to automate marketing, copywriting, and website design tasks ...",https://www.youtube.com/watch?v=Eq3DwmyLUck,www.youtube.com,220,1.93,us,en,172
216,AI marketing,20,AI in Digital Marketing - The Ultimate Guide,AI in Digital Marketing - The Ultimate Guide. No views · 7 hours ago ...more. 10k subscribers challenge. Subscribe. 0. Share. Save.,https://www.youtube.com/watch?v=XPnGUItS6DE,www.youtube.com,220,1.93,us,en,172
217,AI marketing,21,The future of marketing and sales is here. Put AI to work for ...,The future of marketing and sales is here. Put AI to work for you today. No views · 5 minutes ago ...more. Grow On Business Solutions. 3.,https://www.youtube.com/watch?v=REZIhCFxj1M,www.youtube.com,220,1.93,us,en,172
218,AI marketing,22,How AI is Revolutionizing Digital Marketing (And How YOU ...,How AI is Revolutionizing Digital Marketing (And How YOU Can Use It!) Artificial intelligence isn't just the future—it's transforming ...,https://www.youtube.com/watch?v=ZIt5DHaSMO8,www.youtube.com,220,1.93,us,en,172
219,AI Promotion,1,"Promo AI Video Maker by Promo.com - Fast, Simple, Free","Free AI video maker for promo videos, social videos, video ideas, and more... Generate, edit, schedule, and publish your videos with online PromoAI.",https://promo.com/,promo.com,1650000000,1.22,us,en,1
220,AI Promotion,2,Boost Sales with AI: Free Product Promotion Generator Tool,Create captivating and interactive product advertisements to boost your online presence across social media and various channels.,https://www.junia.ai/templates/product-promotion,www.junia.ai,1650000000,1.22,us,en,1
221,AI Promotion,3,5 Ways To Effectively Use AI In Consumer Goods Promotions,Five ways AI and generative AI can enhance promotional strategies · Get a deeper understanding of consumer behavior and segmentation · Optimize promotions' ...,https://www.oliverwyman.com/our-expertise/insights/2024/oct/how-ai-can-enhance-consumer-goods-strategies.html,www.oliverwyman.com,1650000000,1.22,us,en,1
222,AI Promotion,4,How to Design an AI Marketing Strategy,"Such models can recognize images, decipher text, segment customers, and anticipate how customers will respond to various initiatives, such as promotions.",https://hbr.org/2021/07/how-to-design-an-ai-marketing-strategy,hbr.org,1650000000,1.22,us,en,3
223,AI Promotion,5,AI Relevance Engine for Ads & Marketplaces | Promoted,Dramatically better relevance and ads quality and control. Increase revenue by +5-10%. For top marketplaces and scaled e-commerce apps.,https://promoted.ai/,promoted.ai,1650000000,1.22,us,en,1
224,AI Promotion,6,AI Promo Video Maker: Create Stunning Promotional ...,Create engaging promo videos with Steve.AI that showcase your products and services in the best possible light. Boost your conversion.,https://www.steve.ai/promo-video-maker,www.steve.ai,1650000000,1.22,us,en,1
225,AI Promotion,7,AI-Powered Retail Promotional Pricing | Peak,Find out how your retail business can maximize sales across channels without compromising on margin with our AI-powered retail price optimization software.,https://peak.ai/us/products/pricing-ai/promotions/,peak.ai,1650000000,1.22,us,en,1
226,AI Promotion,8,Promo,"The AI solution empowers retailers with data-driven promotion strategies, using advanced simulations to identify the most effective promotion types for goals ...",https://www.invent.ai/promo,www.invent.ai,1650000000,1.22,us,en,1
227,AI Promotion,9,AI and promotion optimization,"Thanks to its algorithm, machine learning ensures the personalization of promotional offers for customer loyalty and predicts the appropriate pricing strategy ...",https://www.verteego.com/en/ai-and-promotion-optimization,www.verteego.com,1650000000,1.22,us,en,1
228,AI Promotion,10,AI and Retail Promotions: How to Hit Your Promotional Goals,"Examples of retail sales promotions, promotional goals, and how predictive analytics and AI technology can help.",https://retalon.com/blog/ai-and-retail-promotions,retalon.com,1650000000,1.22,us,en,1
229,AI Promotion,11,How to make Advertisements and Product Promos with AI,Learn how to make Advertisements and Product Promos with AI using only one AI tool in this step-by-step tutorial video.,https://www.youtube.com/watch?v=0j1jSRZDaQM,www.youtube.com,1650000000,1.22,us,en,172
230,AI Promotion,12,Free AI Promo Video Maker,"Create promo videos in minutes with simple text prompts. Our AI automatically writes the script, creates scenes, adds generative media, voiceovers, ...",https://invideo.io/make/promo-video-maker/,invideo.io,1650000000,1.22,us,en,2
231,AI Promotion,13,AI-Powered Promotion Optimization for Retail,Daisy's AI-powered Promotion Optimization solution utilizes sophisticated algorithms to recommend the right mix of items to promote and not promote.,https://www.daisyintelligence.com/retail-solutions/retail-promotion-optimization,www.daisyintelligence.com,1650000000,1.22,us,en,1
232,AI Promotion,14,AI Relevance Engine for Ads & Marketplaces | Promoted,"Discount Promotions (Offers). Learn about how Promoted.ai can help grow your marketplace with optimized discount promotions, merchandising, and offers.",https://www.promoted.ai/videos/discount-promotions/,www.promoted.ai,1650000000,1.22,us,en,1
233,AI Promotion,15,Argil - Generate videos with your AI clone,Generate engaging AI videos. Get a perfect video for social media of you or a generic avatar in 2 minutes.,https://www.argil.ai/,www.argil.ai,1650000000,1.22,us,en,1
234,AI Promotion,16,AI's Impact On Promo: The Future Is Here,"Industry leaders and veterans reveal how they're using ChatGPT and other AI tools to save time, boost creativity and improve their business.",https://www.ppai.org/media-hub/ai-s-impact-on-promo-the-future-is-here/,www.ppai.org,1650000000,1.22,us,en,2
235,AI Promotion,17,Promoted.ai: Dramatically better search and ads ...,"Promoted.ai unifies search, native ads, and feed ranking for online marketplaces and scaled e-commerce apps to dramatically improve relevance (and revenue) ...",https://www.ycombinator.com/companies/promoted,www.ycombinator.com,1650000000,1.22,us,en,1
236,AI Promotion,18,AI Promotion - AI Consulting,"We help you effectively promote AI-related products, services, and innovations to a targeted, engaged audience.",https://www.aiconsulting.ltd/services/ai-promotion,www.aiconsulting.ltd,1650000000,1.22,us,en,1
237,AI Promotion,19,Promo Video Maker | Create Promo Videos Online With AI,Easily make promotional videos with Synthesia's promo video maker. Use professional video templates to create promo videos for social media.,https://www.synthesia.io/tools/promo-video-maker,www.synthesia.io,1650000000,1.22,us,en,2
238,AI Promotion,20,Google Ads - Get Customers and Sell More with Online ...,"Let Google's AI find your best performing ad formats across Youtube, Discover, Search, and more to maximize conversions. Track, learn, and optimize for ROI.",https://business.google.com/us/google-ads/,business.google.com,1650000000,1.22,us,en,3
239,AI Promotion,21,AI Promo Videos: What are they and how do they work?,"An AI promo video generator automates video production using text input, AI-generated scripts, voiceovers, animations, and templates. Simply provide key details ...",https://www.d-id.com/blog/ai-promo-videos/,www.d-id.com,1650000000,1.22,us,en,1
240,AI Promotion,22,How to Use AI to Promote Content,AI can help you generate fresh content while putting your audience at the center of your content strategy.,https://wordhero.co/how-to-use-ai-to-promote-content/,wordhero.co,1650000000,1.22,us,en,1
241,AI Promotion,23,How to Impress Your Boss Using AI (Promotion? ),In this video I am going to show you how to build AI assistance to make you the most productive person in your company.,https://www.youtube.com/watch?v=J-ikticdB7o,www.youtube.com,1650000000,1.22,us,en,172
242,AI Promotion,24,What do you do if you want a promotion in AI?,"To seek a promotion in AI, focus on demonstrating impact and continuous learning. Highlight your contributions to successful AI projects and keep updating your ...",https://www.linkedin.com/advice/0/what-do-you-want-promotion-ai-skills-artificial-intelligence-rmbdf,www.linkedin.com,1650000000,1.22,us,en,2
243,AI Promotion,25,Artificial Intelligence (AI) and promotional marketing,"AI can be used to streamline creative production, identify target customers, optimise and personalise advertising and measure campaign performance.",https://becomeyoo.com/en/artificial-intelligence-ai-and-promotional-marketing/,becomeyoo.com,1650000000,1.22,us,en,1
244,AI Promotion,26,Summer of Vertical AI Showcase: Account Planning Forecasts ...,"In this this showcase, we see how AI aids in account planning by providing accurate forecasts and product suggestions.",https://www.youtube.com/watch?v=FV-TCcQakxg,www.youtube.com,1650000000,1.22,us,en,172
245,AI Promotion,27,Promo AI,"Promo AI is an AI-based tool that simplifies email marketing. The tool tracks website content, selects high-performing pieces, and compiles newsletters using ...",https://serp.ai/tools/promo-ai/,serp.ai,1650000000,1.22,us,en,1
246,AI Promotion,28,"Promo AI Review: Features, Pros, Cons, & Alternatives","Discover how Promo AI revolutionizes newsletter creation with AI-driven tools, integrated analytics, and customizable templates. Read our review!",https://10web.io/ai-tools/promo-ai/,10web.io,1650000000,1.22,us,en,3
247,AI Promotion,29,The Impact of AI on the Promotional Products Industry - ASI,"By leveraging AI, businesses can enhance customer satisfaction, improve engagement, and drive sales. One of the largest benefits of using AI is the immense ...",https://asicentral.com/insights/10-2024/the-impact-of-ai-on-the-promotional-products-industry/,asicentral.com,1650000000,1.22,us,en,1
248,AI Promotion,30,Promo.ai - Newsletters made easy | Home,Create stunning newsletters in minutes. Promo turns your latest content into amazing weekly / monthly newsletters. Create your first newsletter in minutes.,https://promo.ai/,promo.ai,1650000000,1.22,us,en,1
249,AI Promotion,31,How This AI Can Create Amazing Promo Videos in Seconds!,I'm going to show you how you can make a stunning promo video using just two AI tools.,https://www.youtube.com/watch?v=J-VEs3QB7Cs,www.youtube.com,1650000000,1.22,us,en,172
