,keyword,rank,title,snippet,url,domain,total_results,latency,location,language,domain_popularity
250,AI Promotion,32,Promote AI Tool,Includes: · Daily AI promotion across multiple channels · Custom 1-minute video creation · Multilingual article distribution · Rapid 24-hour approval process.,https://aicoulddothat.net/promote-ai-tool/,aicoulddothat.net,1650000000,1.22,us,en,1
251,AI Promotion,33,How to Personalize Your Offers with AI,"Using Artificial Intelligence to personalize your offers, deals, and promos is a marketing must-do for ecommerce companies.",https://eightbyeight.com/how-to-use-artificial-intelligence-to-personalize-your-coupons-promo-codes-and-other-special-offers-for-maximum-impact/,eightbyeight.com,1650000000,1.22,us,en,1
252,AI Promotion,34,The Impact of AI on the Promotional Products Industry,"According to Forrester, companies that adopt AI marketing strategies see an average 15% increase in productivity. And AI helps us do just that.",https://criterionb.com/blog/ai-impact-promo-products/,criterionb.com,1650000000,1.22,us,en,1
253,AI Promotion,35,Promo.ai,Promo.ai is a website generator that allows users to quickly and easily create stunning newsletters with custom branding. It uses a proprietary algorithm to ...,https://www.futuretools.io/tools/promo-ai,www.futuretools.io,1650000000,1.22,us,en,1
254,AI Promotion,36,Promo's AI Challenges And Opportunities,"“Promo firms are betting big on AI to streamline operations and elevate customer experiences, with cost savings and revenue growth following ...",https://www.ppai.org/media-hub/promos-ai-challenges-and-opportunities/,www.ppai.org,1650000000,1.22,us,en,2
255,AI Promotion,37,How one station used AI to automate promotions and save ...,"Our station's programming department edits audio on one of two programs. The first is Adobe Audition. The other is dBPoweramp, a program that we use either to ...",https://current.org/2023/12/how-one-station-used-ai-to-automate-promotions-and-save-time/,current.org,1650000000,1.22,us,en,1
256,AI Promotion,38,How To Use AI - Promotions,"Use AI To Engage Audiences, Generate New Revenue, And Find New Listeners · How To Use AI For Target Audience Personas · Prompt: Use AI To Improve Subject Lines.",https://insidersradionetwork.com/how-to-use-ai/how-to-use-ai-promotions/,insidersradionetwork.com,1650000000,1.22,us,en,1
257,AI Promotion,39,"Promoted AI Review: Features, Pros, and Cons","Promoted is an AI-driven platform designed to enhance marketplace search, discovery, and ad performance. By utilizing advanced machine learning and AI ...",https://10web.io/ai-tools/promoted/,10web.io,1650000000,1.22,us,en,3
258,AI Promotion,40,Free Promo Video Maker - Create Promo Videos Online,"From events and campaigns to holiday sales, Canva's easy promo video maker has all the tools and features you need to create a compelling promotional video.",https://www.canva.com/create/promo-videos/,www.canva.com,1650000000,1.22,us,en,3
259,AI Promotion,41,"AI Code Makers Coupons, Promo Codes & Deals","We've curated a selection of the top ai code makers, ai coding tools and ai code completion coupons, discounts, and promo codes as rated by our community.",https://simplycodes.com/category/artificial-intelligence/ai-content-creation/ai-code-generators,simplycodes.com,1650000000,1.22,us,en,2
260,AI Promotion,42,Promo Insiders: The Reality & Future of AI - ASI,Mittica to share their expertise by discussing how businesses can use AI right now and the best practices to get started. Young also shares how ...,https://members.asicentral.com/news/podcast/promo-insiders/the-reality-future-of-ai/,members.asicentral.com,1650000000,1.22,us,en,1
261,AI Promotion,43,Season of AI Promo AI is Free Until the End of the Year!,Visit https://help.gohighlevel.com/support/solutions/articles/155000004109-highlevel-s-ai-employee-promo for more 3-Day Virtual Workshop ...,https://www.youtube.com/watch?v=CmiPlvWix_0,www.youtube.com,1650000000,1.22,us,en,172
262,AI Promotion,44,The Association for the Advancement of Artificial Intelligence,AAAI is an artificial intelligence organization dedicated to advancing the scientific understanding of AI.,https://aaai.org/,aaai.org,1650000000,1.22,us,en,1
263,AI Promotion,45,Ethics of Artificial Intelligence,"Public understanding of AI and data should be promoted through open & accessible education, civic engagement, digital skills & AI ethics training, media & ...",https://www.unesco.org/en/artificial-intelligence/recommendation-ethics,www.unesco.org,1650000000,1.22,us,en,1
264,AI Promotion,46,Intelligent Retail Pricing and Promotion Optimization,"From grocery and fashion to electronics and CPG, retailers are adopting AI-driven IRP&PO solutions to dynamically respond to market signals, ...",https://www.globenewswire.com/news-release/2025/04/14/3061119/0/en/Intelligent-Retail-Pricing-and-Promotion-Optimization-IRP-PO-Market-on-a-Steady-Growth-Path-Projected-to-Grow-Through-2030-at-CAGR-13-72.html,www.globenewswire.com,1650000000,1.22,us,en,3
265,AI Promotion,47,Samsung Promotions | Redeem Retail Offers | Samsung US,Galaxy AI. TV & Audio. TV & Audio. TVs. Shop All TVs · Neo QLED TVs · OLED ... Step 1: Purchase and activate a qualified TV within the valid purchase date. Step 2 ...,https://www.samsung.com/us/promotions/,www.samsung.com,1650000000,1.22,us,en,2
266,AI Promotion,48,2025 Integrated Technology Promotion | PostalPro,USPS Mailing Promotions seek to increase engagement and response rates for Mailers by leveraging high value mailpieces. Promotions. 2025 ...,http://postalpro.usps.com/promotions/25-it,postalpro.usps.com,1650000000,1.22,us,en,1
267,AI Promotion,49,Promotion Terms - Google Fi,"Get a year of Gemini Advanced and more benefits with the Google One AI Premium plan: The best of Google AI. Get access to Gemini Advanced, your all-access ...",https://fi.google.com/about/promo-terms/?p=2024-P9Pro-ProXL-ProFold-G&srsltid=AfmBOorzDSw1_DxClSCnt2o6zZyhlFdORQhmO8-riugg1VQ3LmPOg3Hn,fi.google.com,1650000000,1.22,us,en,1
268,AI Promotion,50,About promotion assets for App campaigns,"Currently, promotion assets for App campaigns are eligible to serve on Google Display Network and YouTube. Promotion assets are powered by Google AI. Promotion ...",https://support.google.com/google-ads/answer/13814372?hl=en,support.google.com,1650000000,1.22,us,en,1
269,AI Promotion,51,UN Tourism Artificial Intelligence Challenge,"Elevating Brand Value: Reputation, Branding & Marketing Focus on enhancing destination branding and promotion through the use of AI and deep technologies.",http://www.unwto.org/challenges/artificial-intelligence-challenge,www.unwto.org,1650000000,1.22,us,en,1
270,AI Promotion,52,AI eBook Promotion Generator [Start for Free],How to start with the AI eBook Promotion Generator. Create a free account at StoryLab.ai and select the AI eBook Promotion Generator. Select a ...,https://storylab.ai/ai-ebook-promotion-generator/,storylab.ai,1650000000,1.22,us,en,2
271,AI Promotion,53,Promotion of Research and Development in Information ...,"Promotion of Research and Development in Information Science and Technology ... In particular, artificial intelligence (AI) has come to attract people's ...",https://www.mext.go.jp/en/policy/science_technology/researchpromotion/title01/detail01/1374075.htm,www.mext.go.jp,1650000000,1.22,us,en,1
272,AI Promotion,54,Invideo AI Coupon Codes | 50% Off April Promo Codes,30% OFF Invideo AI CouponFollow Exclusive | 30% Off Annual Studio Membership CODE • ✔ Verified See Details exclusive 25% OFF Invideo AI 25% Off Monthly Studio ...,https://couponfollow.com/site/invideo.io,couponfollow.com,1650000000,1.22,us,en,2
273,AI Promotion,55,deal.ai,Everything Your Business Needs In One AI Platform.,https://deal.ai/,deal.ai,1650000000,1.22,us,en,1
274,AI Promotion,56,General Assembly adopts landmark resolution on artificial ...,"The UN General Assembly on Thursday adopted a landmark resolution on the promotion of “safe, secure and trustworthy” artificial intelligence (AI) systems.",https://news.un.org/en/story/2024/03/1147831,news.un.org,1650000000,1.22,us,en,1
275,AI Promotion,57,Google One AI Premium Plan and Features,"Unlock the best of Google AI with the Google One AI Premium Plan. Get Gemini Advanced, 2 TB storage, and enhanced AI features across Google apps.",https://one.google.com/about/ai-premium/,one.google.com,1650000000,1.22,us,en,3
276,AI Promotion,58,Collibra: Unified governance for data and AI,"Collibra helps organizations do more with trusted data. Our data Intelligence solutions include AI Governance, Data Catalog, Data Governance, Data Quality ...",https://www.collibra.com/,www.collibra.com,1650000000,1.22,us,en,1
277,AI Promotion,59,✍️ AI Agent to Create Linkedin Posts for Blog Promotion ...,"Tags: Automation, AI, Marketing, Content CreationContextI'm a Supply Chain Data Scientist and content creator who writes regularly about ...",https://n8n.io/workflows/3500-ai-agent-to-create-linkedin-posts-for-blog-promotion-with-gpt-4o/,n8n.io,1650000000,1.22,us,en,1
278,AI Promotion,60,How AI Skills Can Help You Get a Promotion,"In this article, you will discover some of the most important things to know about AI and how they can help you advance your career.",https://www.linkedin.com/advice/1/you-want-get-promotion-what-most-important-mw4je,www.linkedin.com,1650000000,1.22,us,en,2
279,AI Promotion,61,SonicLock Launches AI-Powered Global Music Marketing ...,"... promotion, today announced the official launch of its groundbreaking AI-powered music marketing platform. This cutting-edge platform is ...",https://www.streetinsider.com/ACCESS+Newswire/SonicLock+Launches+AI-Powered+Global+Music+Marketing+Platform%2C+Ushering+in+a+New+Era+for+Artist+Promotion/24632828.html,www.streetinsider.com,1650000000,1.22,us,en,1
280,AI Promotion,62,Gemini Advanced - get access to Google's most capable AI ...,"Try Google's most capable AI models with Gemini 2.0, priority access to new features including Deep Research & 1 million token context window.",https://gemini.google/advanced/?hl=en,gemini.google,1650000000,1.22,us,en,1
281,AI Promotion,63,"S.A.R.A.H, a Smart AI Resource Assistant for Health","Sarah is a prototype of a digital health promoter, available 24/7 in eight languages via video or text. She can provide tips to destress, eat right, quit ...",https://www.who.int/campaigns/s-a-r-a-h,www.who.int,1650000000,1.22,us,en,1
282,AI Promotion,64,Vertex AI pricing,Review pricing information for Vertex AI.,https://cloud.google.com/vertex-ai/pricing,cloud.google.com,1650000000,1.22,us,en,3
283,AI Promotion,65,AI JINGLEMAKER - Easy affordable audio jingle creation.,"‍ It's so easy, so fast and the results are amazing. I've been using the AI JingleMaker for my podcast intros and my promos for a few weeks. It definitely ...",https://www.aijinglemaker.com/,www.aijinglemaker.com,1650000000,1.22,us,en,1
284,AI Promotion,66,Promoting the Use of Trustworthy Artificial Intelligence in ...,"It is the policy of the United States to promote the innovation and use of AI, where appropriate, to improve Government operations and services.",https://www.federalregister.gov/documents/2020/12/08/2020-27065/promoting-the-use-of-trustworthy-artificial-intelligence-in-the-federal-government,www.federalregister.gov,1650000000,1.22,us,en,1
285,AI Promotion,67,AI avatar generator Synthesia does video footage deal with ...,... promotion. Sign up to Business Today. Free daily newsletter. Get set for the working day – we'll point you to all the business news and ...,https://www.theguardian.com/technology/2025/apr/10/ai-avatar-generator-synthesia-video-footage-shutterstock,www.theguardian.com,1650000000,1.22,us,en,2
286,AI Promotion,68,I Should Not Have to Fight for Fair Treatment in the ...,"D.K., a Pawnee woman who is Deaf, was denied a promotion after being assessed through biased automated hiring technology.",https://www.aclu.org/news/disability-rights/i-should-not-have-to-fight-for-fair-treatment-in-the-workplace,www.aclu.org,1650000000,1.22,us,en,1
287,AI Promotion,69,Lovable AI Promo Codes for 2025 (Up to 60% Off!),Loveable Ai Coupon promo codes 2025 Get 60% OFF . Contribute to malikikram54999/Loveable-Ai-Coupon-promo-codes-2025-Get-60-OFF- development ...,https://github.com/malikikram54999/Loveable-Ai-Coupon-promo-codes-2025-Get-60-OFF-/blob/main/README.md,github.com,1650000000,1.22,us,en,1
288,AI Promotion,70,Erica - Virtual Financial Assistant,Erica uses an artificial intelligence called natural language processing that's grounded in machine learning (not generative AI or large language models) to ...,https://promotions.bankofamerica.com/digitalbanking/mobilebanking/erica,promotions.bankofamerica.com,1650000000,1.22,us,en,1
289,AI Promotion,71,IAPP,Renew now to avoid a lapse in benefits. Learn More · AI promotional image · IAPP News image. Resources. IAPP Global ...,https://iapp.org/,iapp.org,1650000000,1.22,us,en,1
290,AI Promotion,72,Google Ads - Get Customers and Sell More with Online ...,"Let Google's AI find your best performing ad formats across Youtube, Discover, Search, and more to maximize conversions. A line graph tracks conversion ...",https://ads.google.com/home/,ads.google.com,1650000000,1.22,us,en,1
291,AI Promotion,73,Free Promo Video Maker: Create The Best Promo Videos,"Free promo video maker of FlexClip enables you create striking promo videos, ads & posters with free promotional video templates, assets, music & AI tools!",https://www.flexclip.com/create/promo-video.html,www.flexclip.com,1650000000,1.22,us,en,1
292,AI Promotion,74,Minta Social Videos Auto Post,"Create AI product video ads with Minta's video maker. Automate the social media promo video production process + auto post on: TikTok, Facebook, Instagram.",https://apps.shopify.com/minta-video-auto-post,apps.shopify.com,1650000000,1.22,us,en,1
293,AI Promotion,75,SonicLock Launches AI-Powered Global Music Marketing ...,"... promotion, today announced the official launch of its groundbreaking AI-powered music marketing platform. This cutting-edge platform is ...",https://www.theglobeandmail.com/investing/markets/markets-news/ACCESS%20Newswire/31865344/soniclock-launches-ai-powered-global-music-marketing-platform-ushering-in-a-new-era-for-artist-promotion/,www.theglobeandmail.com,1650000000,1.22,us,en,1
294,AI Promotion,76,AI ENGLISH 🤖 | PAID PROMOTION AVAILABLE... Daily learn ...,"10 likes, 0 comments - fast_english_spoken on April 13, 2025: ""PAID PROMOTION AVAILABLE... Daily learn english.",https://www.instagram.com/reel/DIaZspxybt2/,www.instagram.com,1650000000,1.22,us,en,8
295,AI Promotion,77,Freepik Promo Codes & Coupons April 2025,Designs.ai promo code. 25% Off (Storewide) (Members Only) at Designs.ai. Designs.ai. MC25OFF. Copy code. See all Designs.ai codes. Creative OS promo code. 50% ...,https://simplycodes.com/store/freepik.com,simplycodes.com,1650000000,1.22,us,en,2
296,AI Promotion,78,Monitoring oral health remotely: ethical considerations ...,This perspective article critically examines the rapid expansion of remote monitoring technologies—including artificial intelligence (AI)-driven diagnostics ...,https://www.frontiersin.org/journals/oral-health/articles/10.3389/froh.2025.1587630/full,www.frontiersin.org,1650000000,1.22,us,en,1
297,AI Promotion,79,ACD Announces Promotion of Brian Callahan to Senior ...,"AI and Advanced Tech · In Secret Meeting, China Acknowledged Role in U.S. Infrastructure Hacks · Border Security · Gen. Dan Caine Confirmed as ...",https://www.hstoday.us/industry/people-on-the-move/acd-announces-promotion-of-brian-callahan-to-senior-vice-president-of-government-affairs/,www.hstoday.us,1650000000,1.22,us,en,1
298,AI Promotion,80,Copilot Pro Plan & Pricing – Premium AI Features & Latest ...,Microsoft Copilot Pro. Preferred access to the latest AI models & more usage. Get 1 month free. $20.00 user/month.,https://www.microsoft.com/en-us/store/b/copilotpro,www.microsoft.com,1650000000,1.22,us,en,1
299,AI Promotion,81,Gamma App Promo Codes & Offers: Flat 25% OFF Apr 2025,Verified Gamma App Coupons & Discount Codes For April 2025 | Flat 25% OFF On Annual Subscription Plans | 400 AI credits With FREE Plan | Monthly Plans ...,https://www.grabon.in/gamma-app-coupons/,www.grabon.in,1650000000,1.22,us,en,2
300,AI Promotion,82,A new era of cryptocurrency in Pakistan: Bitcoin mining and ...,A new era of cryptocurrency in Pakistan: Bitcoin mining and AI promotion. Crypto PM. --. Follow. A new era is dawning! Pakistan has taken a big ...,https://www.binance.com/en/square/post/22718881593569,www.binance.com,1650000000,1.22,us,en,1
301,AI Promotion,83,Intelligent Retail Pricing and Promotion Optimization ( ...,"As retailers prioritize price agility and promotion ROI over static discounting, vendors must deliver AI-driven models that scale across ...",https://finance.yahoo.com/news/intelligent-retail-pricing-promotion-optimization-153000510.html,finance.yahoo.com,1650000000,1.22,us,en,3
302,AI Promotion,84,Game Bundle Participating Retailers,Ryzen AI for Business. Personal & Gaming. Ryzen Laptops · Ryzen Desktops ... Promotions & Bundles · Shop All. Adaptive & Embedded Computing. System-on-Modules ...,https://www.amd.com/en/where-to-buy/bundles/monster-hunter-wilds-game-bundle.html,www.amd.com,1650000000,1.22,us,en,1
303,AI Promotion,85,75% OFF ChatGPT Coupon Codes - April 2025 Promo Codes,Best ChatGPT Coupons. ChatGPT promo: get 30-day free trial to explore AI assistance. Deal. verify Verified 9 days ago use 1220 Uses. GREATOFFER Get Deal. Enjoy ...,https://chatgpt.tenereteam.com/coupons,chatgpt.tenereteam.com,1650000000,1.22,us,en,1
304,AI Promotion,86,AI Animation Generator,"First, cookies. We would like to use cookies on the website to ensure the security, efficient operation and service optimization of the website.",https://vmake.ai/ai-promo-video/start,vmake.ai,1650000000,1.22,us,en,1
305,AI Promotion,87,Gerry Adams considers suing Meta over alleged use of his ...,... promotion. Sign up to First Edition. Free daily newsletter. Our ... Artificial intelligence (AI) · Meta · Computing · news. Share. Reuse this ...,https://www.theguardian.com/politics/2025/apr/10/gerry-adams-considers-suing-meta-over-alleged-use-of-his-books-to-train-ai,www.theguardian.com,1650000000,1.22,us,en,2
306,AI Promotion,88,LANDR: The Best Music Production Software for Creators,"Try the world's best music production platform for free! Get AI mastering, music distribution, pro-grade plugins, free samples, premium courses, and more.",https://www.landr.com/?srsltid=AfmBOor6yEbGV7XiR8PDc14dLbauW5jdR6A0Bp8NxzCT2YsExFdME3F4,www.landr.com,1650000000,1.22,us,en,1
307,AI Promotion,89,Abul Baki Receives Tenure and Promotion to Associate ...,"... artificial intelligence (AI). His research focuses on ecohydraulics, ecological river restoration, microplastics pollution, hydrodynamics ...",https://www.clarkson.edu/news-events/abul-baki-receives-tenure-and-promotion-associate-professor-clarkson-university,www.clarkson.edu,1650000000,1.22,us,en,1
308,AI Promotion,90,Renderforest: All your design tools in one place,"Find the Right AI Tools for You · Video Marketing. Grow your business presence using advanced promotional videos, explainer animations, tutorials, intros, outros ...",https://www.renderforest.com/,www.renderforest.com,1650000000,1.22,us,en,1
309,AI Promotion,91,Chromebooks Come with Perks,AI Premium Plan. Unlock the best of Google AI for 3 months with the Google ... promotion. Close Window Redeem on Google Play. You may or may not be ...,https://www.google.com/chromebook/perks/,www.google.com,1650000000,1.22,us,en,1
310,AI Promotion,92,"Mailchimp: Marketing, Automation & Email Platform","Use real-time behavior data and AI to convert more customers with Mailchimp's marketing, automation & email marketing platform.",https://mailchimp.com/,mailchimp.com,1650000000,1.22,us,en,3
311,AI Promotion,93,MyRoutine AI Skin Analysis Tool | Skincare Quiz,"MyRoutine AI: YOUR PERSONAL SKIN ANALYSIS WITH ONE PHOTO. Developed with ... By checking this box, I agree to receive recurring promotional and ...",https://www.laroche-posay.us/find-your-routine/myroutine-ai-analysis.html?srsltid=AfmBOoqR-S0DfuvjRoE8tPjcG9ahDkhsacOyExoKlUjviH7PafCEAAzL,www.laroche-posay.us,1650000000,1.22,us,en,1
312,AI Promotion,94,AI ENGLISH 🤖 | Paid promotion available Daily learn english ...,Very easy sentences PH @#%! ताना मारना Taunt चुगली करना Backbite Edited By Dominic Backbit . Very easy sentences जन छानना YOP Strain ge गूंथना Knead ...,https://www.instagram.com/reel/DIYuzkTNY8W/,www.instagram.com,1650000000,1.22,us,en,8
313,AI Promotion,95,Digital India Bhashini Revolutionising Language Accessibility ...,Digital India Bhashini is a groundbreaking initiative designed to break down India's language barriers using advanced AI models.,https://egov.eletsonline.com/2025/04/digital-india-bhashini-revolutionising-language-accessibility-with-ai-powered-solutions/,egov.eletsonline.com,1650000000,1.22,us,en,1
314,AI Promotion,96,Strengthening American Leadership in Digital Financial ...,"(ii) promoting and protecting the sovereignty of the United ... AI and Crypto (Chair). In addition to the Chair, the Working Group ...",https://www.whitehouse.gov/presidential-actions/2025/01/strengthening-american-leadership-in-digital-financial-technology/,www.whitehouse.gov,1650000000,1.22,us,en,2
315,AI Promotion,97,Plans & Pricing to Upgrade Your Cloud Storage,"Google One has cloud storage plans for everyone. Discover what each plan offers, including access to Gemini Advanced with the AI Premium plan.",https://one.google.com/about/plans,one.google.com,1650000000,1.22,us,en,3
316,AI Promotion,98,Insider Tips for Using AI To Streamline Your Promo Business,"Share your videos with friends, family, and the world.",https://www.youtube.com/watch?v=cDD8hgB3GyM,www.youtube.com,1650000000,1.22,us,en,172
317,AI Promotion,1,Strengthening American Leadership in Digital Financial ...,"(ii) promoting and protecting the sovereignty of the United ... AI and Crypto (Chair). In addition to the Chair, the Working Group ...",https://www.whitehouse.gov/presidential-actions/2025/01/strengthening-american-leadership-in-digital-financial-technology/,www.whitehouse.gov,155,2.14,us,en,2
318,AI Promotion,2,Top AI Promo Codes - Best Coupons For 2025,AI Promo Codes (2025) · Koala · Texta.ai · Copy.ai · Otter.ai · Gamma · Recraft · HARPA AI · Perplexity AI. 16% discount. Get Offer. Vidnoz AI Logo ...,https://aipromo.codes/,aipromo.codes,155,2.14,us,en,1
319,AI Promotion,3,Plans & Pricing to Upgrade Your Cloud Storage,"Google One has cloud storage plans for everyone. Discover what each plan offers, including access to Gemini Advanced with the AI Premium plan.",https://one.google.com/about/plans,one.google.com,155,2.14,us,en,3
320,AI Promotion,4,Pyramid Global Hospitality Announces the Promotion of ...,"PRNewswire/ -- Pyramid Global Hospitality today announces its chief operating officer, Eric Habermann, will retire this month following ...",https://www.prnewswire.com/news-releases/pyramid-global-hospitality-announces-the-promotion-of-key-leadership-following-the-retirement-of-chief-operating-officer-302427073.html,www.prnewswire.com,155,2.14,us,en,2
321,AI Promotion,5,Free Trial and Free Tier Services and Products,"Get free usage of AI APIs, Compute Engine, BigQuery, and other popular products up to monthly limits—not charged against your $300 free credit. Free Tier ...",https://cloud.google.com/free,cloud.google.com,155,2.14,us,en,3
322,AI Promotion,6,AI ENGLISH 🤖 | Paid promotion available .. DAILY LEARN ...,"70 likes, 3 comments - fast_english_spoken on April 11, 2025: ""Paid promotion available .. DAILY LEARN ENGLISH.",https://www.instagram.com/p/DITFUdyS_3c/,www.instagram.com,155,2.14,us,en,8
323,AI Promotion,7,Berries | AI Scribe for Mental Health Professionals,"Berries is helping mental health professionals to better focus on patients over documentation. It's like having a traditional medical scribe, but optimized ...",https://heyberries.com/,heyberries.com,155,2.14,us,en,1
324,AI Promotion,8,Challenge and Sweepstakes Official Rules,"... promotion, or the family members of each above (parents, children, siblings, spouse/domestic partners, or individuals residing in the same household). Void ...",https://learn.microsoft.com/en-us/training/topics/event-challenges/ai-skills-fest-challenge-official-rules,learn.microsoft.com,155,2.14,us,en,1
325,AI Promotion,9,75% OFF /ai Coupon Codes - March 2025 Promo Codes,75% OFF Get Code Highly-regarded coupon code! All customers will enjoy a 70% discount when they use this /ai deal.,https://ai.tenereteam.com/coupons,ai.tenereteam.com,155,2.14,us,en,1
326,AI Promotion,10,Cursor AI Promo Codes - 60% Off Discount Code April 2025,"We have 4 Cursor AI offers today, good for discounts at cursor.com and other retail websites. Today's biggest discount: your purchase.",https://dealspotr.com/promo-codes/cursor.com,dealspotr.com,155,2.14,us,en,2
327,AI Promotion,11,Midjourney Coupons & Promo Codes Apr 2025,Midjourney is an exceptional example of generative AI that harnesses the power of artificial intelligence to create stunning images based on text prompts. It is ...,https://www.grabon.in/midjourney-coupons/,www.grabon.in,155,2.14,us,en,2
328,AI Promotion,12,Apple sued for false advertising over Apple Intelligence,"The lawsuit focuses on Apple's promotion of AI features in Siri that were delayed ... Worse yet, Defendant promoted its Products based on these ...",https://www.axios.com/2025/03/20/apple-suit-false-advertising-ai-intelligence,www.axios.com,155,2.14,us,en,1
