,keyword,rank,title,snippet,url,domain,total_results,latency,location,language,domain_popularity
0,AI marketing,1,25 best AI marketing tools I'm using to get ahead in 2025,Discover the 25 best AI marketing tools some of the biggest brands use today. Learn how marketing teams are using artificial intelligence to grow fast.,https://www.marketermilk.com/blog/ai-marketing-tools,www.marketermilk.com,3930000000,1.09,us,en,1
1,AI marketing,2,Marketing AI Institute | Artificial Intelligence for Marketing,"Marketing AI Institute is a media, event, and online education company making AI approachable and accessible to marketing and business leaders around the world.",https://www.marketingaiinstitute.com/,www.marketingaiinstitute.com,3930000000,1.09,us,en,1
2,AI marketing,3,How to Design an AI Marketing Strategy,"AI can streamline the sales process by using extremely detailed data on individuals, including real-time geolocation data, to create highly personalized product ...",https://hbr.org/2021/07/how-to-design-an-ai-marketing-strategy,hbr.org,3930000000,1.09,us,en,3
3,AI marketing,4,AI that's built for marketing – Jasper,Jasper is purpose-built AI that helps enterprise marketers build AI-powered apps and workflows tied to real business outcomes.,https://www.jasper.ai/,www.jasper.ai,3930000000,1.09,us,en,4
4,AI marketing,5,Your AI Powerhouse for All Advertising Needs,"#1 most used AI tool for advertising. Generate ad banners, texts, photoshoots, and videos that outperform those of your competitors.",https://www.adcreative.ai/,www.adcreative.ai,3930000000,1.09,us,en,1
5,AI marketing,6,24 AI marketing tools your team should be using in 2025,AI marketing tools help teams speed up workflows and extract customer insights. Explore a list of 24 AI marketing tools to save time and ...,https://sproutsocial.com/insights/ai-marketing-tools/,sproutsocial.com,3930000000,1.09,us,en,2
6,AI marketing,7,AI for Marketing Course,"Discover the transformative power of AI in marketing campaigns, from conceptualization to performance analysis. Begin by learning the process of infusing AI ...",https://academy.hubspot.com/courses/AI-for-Marketers,academy.hubspot.com,3930000000,1.09,us,en,1
7,AI marketing,8,What is AI Marketing?,Marketing AI works by processing data with algorithms and pattern recognition to simulate human intelligence. It uses machine learning and deep learning to ...,https://www.salesforce.com/marketing/ai/guide/,www.salesforce.com,3930000000,1.09,us,en,2
8,AI marketing,9,I Replaced My Entire Marketing Team With AI (Beginners Guide),In this video I'm going to break down all of the AI models that we use every single day in our company.,https://www.youtube.com/watch?v=Y4FrXrH2pbE,www.youtube.com,3930000000,1.09,us,en,172
9,AI marketing,10,How Should Gen AI Fit into Your Marketing Strategy?,"For example, in marketing and customer-facing functions, it can be used to generate offers, ads, new product images, blog posts, messages for ...",https://hbr.org/2025/03/how-should-gen-ai-fit-into-your-marketing-strategy,hbr.org,3930000000,1.09,us,en,3
10,AI marketing,11,How AI is Impacting Digital Marketing,"Marketers now use AI to create content, craft campaigns, improve conversion rates, forecast results, enhance the customer experience, and more.",https://sps.wfu.edu/articles/how-ai-impacts-digital-marketing/,sps.wfu.edu,3930000000,1.09,us,en,1
11,AI marketing,12,What is AI in marketing? | Cognizant,"AI in marketing is the process of leveraging AI methods and tools such as data models, algorithms and machine learning to produce customer insights.",https://www.cognizant.com/us/en/glossary/ai-marketing,www.cognizant.com,3930000000,1.09,us,en,1
12,AI marketing,13,A.I. MARKETING - Digital Marketing made better with AI,"AI MARKETING helps companies professionalize their marketing and advertising processes, scale their business using the Internet, and thus reach new markets ...",https://aimarketingservices.com/,aimarketingservices.com,3930000000,1.09,us,en,1
13,AI marketing,14,"How To Use AI to Start, Build & Grow Your Small Business (20 ...",I have found the best AI tools to take your business from startup to scale faster than you thought possible.,https://www.youtube.com/watch?v=nkuPUJVzB_E,www.youtube.com,3930000000,1.09,us,en,172
14,AI marketing,15,AI for Marketers | ANA,The ANA's Artificial Intelligence practice aims to empower marketers with a suite of pragmatic resources that help brands incorporate AI into their strategic ...,https://www.ana.net/ai,www.ana.net,3930000000,1.09,us,en,1
15,AI marketing,16,How AI is transforming marketing - News - Missouri State ...,"AI is fundamentally reshaping marketing, offering more efficient, personalized and data-driven approaches to customer engagement.",https://news.missouristate.edu/2024/10/03/how-ai-is-transforming-marketing/,news.missouristate.edu,3930000000,1.09,us,en,1
16,AI marketing,17,Artificial Intelligence (AI) Marketing,"Access processes, tools and features that use predictive and generative AI to anticipate, automate, and personalize every customer interaction.",https://emarsys.com/ai-marketing/,emarsys.com,3930000000,1.09,us,en,2
17,AI marketing,18,This AI Marketing Strategy Would Cost You $25K - But It’s FREE,Curious how we used AI to skyrocket our conversion by 82%? Find out here: https://clickhubspot.com/mds Want Kipp's Prompt?,https://www.youtube.com/watch?v=49uoV2k6btA,www.youtube.com,3930000000,1.09,us,en,172
18,AI marketing,19,AI Marketing | The Complete Guide,"From personalized product demos to targeted email campaigns, AI ensures manufacturers effectively nurture leads and close deals in highly competitive markets.",https://www.on24.com/guides/ai-marketing/,www.on24.com,3930000000,1.09,us,en,1
19,AI marketing,20,AI in Marketing,"AI marketing is the process of using AI capabilities like data collection, data-driven analysis, natural language processing (NLP) and machine learning (ML) to ...",https://www.ibm.com/think/topics/ai-in-marketing,www.ibm.com,3930000000,1.09,us,en,1
20,AI marketing,21,The 12 best AI marketing tools in 2025,The best AI marketing tools for social media · AI social media management editors like FeedHive · Free AI design tools like Canva · Create Canva ...,https://zapier.com/blog/best-ai-marketing-tools/,zapier.com,3930000000,1.09,us,en,3
21,AI marketing,22,8 Ways to Use AI in Digital Marketing [+Examples],"AI in digital marketing is the use of artificial intelligence to plan, execute, or optimize a company's marketing efforts.",https://blog.hubspot.com/marketing/ai-marketing,blog.hubspot.com,3930000000,1.09,us,en,2
22,AI marketing,23,Artificial Intelligence in Marketing,"Use data-driven AI to improve customer engagement, how to develop networked business models and leverage network effects, how to build a sustainable ...",https://www.coursera.org/learn/uva-darden-artificial-intelligence-marketing,www.coursera.org,3930000000,1.09,us,en,2
23,AI marketing,24,AI Marketing Tools by Marketing Cloud,"AI marketing tools built directly into your platform. Build end-to-end campaigns, personalize every touch point across the customer relationship in real-time.",https://www.salesforce.com/marketing/ai/,www.salesforce.com,3930000000,1.09,us,en,2
24,AI marketing,25,What Are the Best AI Marketing Tools?,"Examples of AI marketing tools include chatbots, predictive analytics platforms, recommendation engines, and content generation systems.",https://digitalmarketinginstitute.com/blog/what-are-the-best-ai-and-marketing-automation-tools,digitalmarketinginstitute.com,3930000000,1.09,us,en,2
25,AI marketing,26,AI Marketing Tools,Say hello to your AI growth assistant. See how Mailchimp's powerful AI tools help you make better decisions about marketing your business.,https://mailchimp.com/solutions/ai-tools/,mailchimp.com,3930000000,1.09,us,en,3
26,AI marketing,27,How I Run A 0-Employee Marketing Agency With AI Tools,"A solo entrepreneur who's running a six figure business by themselves with AI walk me through exactly what they did, the tools they use, their workflow.",https://www.youtube.com/watch?v=9QbFg4kiNpY,www.youtube.com,3930000000,1.09,us,en,172
27,AI marketing,28,What is AI Marketing? A Complete Guide,"AI marketing involves using AI algorithms to analyze consumer data and create personalized marketing campaigns. However, ethical concerns and ...",https://www.marketingevolution.com/marketing-essentials/ai-markeitng,www.marketingevolution.com,3930000000,1.09,us,en,1
28,AI marketing,29,How AI Is Transforming The Marketing Industry,"By harnessing the power of AI, marketers can now create dynamic and responsive content that resonates deeply with consumers on an individual ...",https://www.forbes.com/councils/forbestechcouncil/2024/03/21/how-ai-is-transforming-the-marketing-industry/,www.forbes.com,3930000000,1.09,us,en,2
29,AI marketing,30,AI for Marketing | AWS Solutions for Artificial Intelligence,Artificial Intelligence (AI) brings significant benefits to the marketing function by enabling the creation of highly personalized and targeted content at ...,https://aws.amazon.com/solutions/ai/ai-marketing/,aws.amazon.com,3930000000,1.09,us,en,2
30,AI marketing,31,AI in Marketing: The Future of Smart Marketing,"Learn how you can use AI in marketing to boost results through enhanced content, streamlined operations and more personalized, engaging campaigns and CX.",https://www.gartner.com/en/marketing/topics/ai-in-marketing,www.gartner.com,3930000000,1.09,us,en,2
31,AI marketing,32,AI Marketing Analytics: 5 Ways to Sharpen Your Insights,"AI is leveraged in marketing analytics to enhance customer understanding, personalize marketing efforts, and optimize campaign performance.",https://improvado.io/blog/ai-marketing-analytics,improvado.io,3930000000,1.09,us,en,2
32,AI marketing,33,Gen AI for Marketing with Gemini for Workspace,"Learn how Gemini for Workspace uses advanced gen AI to help quickly craft messaging, organize complex data, summarize documents and more.",https://workspace.google.com/solutions/ai/marketing/,workspace.google.com,3930000000,1.09,us,en,1
33,AI marketing,34,The role of artificial intelligence in marketing,AI marketing combines AI technologies with customer and brand experience data to provide highly precise insights into your customer journey and market trends.,https://sproutsocial.com/insights/ai-marketing/,sproutsocial.com,3930000000,1.09,us,en,2
34,AI marketing,35,5 Must-Have AI Tools for Businesses and Marketers,I test out ton of different AI tools every single week and in this video I wanted to show you five that I specifically Ed for different business use cases.,https://www.youtube.com/watch?v=J1qBYAXHTpU,www.youtube.com,3930000000,1.09,us,en,172
35,AI marketing,36,AI Marketing: A Guide to Artificial Intelligence Marketing,AI marketing helps marketing teams make sense of data in real-time to improve the efficiency and results of marketing operations.,https://business.adobe.com/blog/basics/ai-marketing,business.adobe.com,3930000000,1.09,us,en,2
36,AI marketing,37,The Top 10 AI Tools for Marketers (Updated 2024),"Common features of AI tools in marketing include SEO optimization, content creation, and predictive analytics. AI tools can also enable ...",https://www.pecan.ai/blog/top-10-ai-marketing-tools/,www.pecan.ai,3930000000,1.09,us,en,1
37,AI marketing,38,20 Best AI Marketing Tools & Strategies (2025),"Discover the 20 best AI marketing tools and strategies of 2025 to streamline campaigns, boost creativity, and drive results.",https://www.synthesia.io/learn/ai-applications/marketing,www.synthesia.io,3930000000,1.09,us,en,2
38,AI marketing,39,AI for Marketing: Top Tips and Tools from ...,"AI marketing is the use of AI technology (often AI content generation tools) to automate marketing tasks, increase team efficiency, and stoke creativity.",https://www.jasper.ai/blog/ai-for-marketing,www.jasper.ai,3930000000,1.09,us,en,4
39,AI marketing,40,Marketing AI - eCornell - Cornell University,You will analyze your customer's journey and determine what parts of the marketing process can be supercharged by integrating machine learning and AI. In ...,https://ecornell.cornell.edu/certificates/marketing/marketing-ai/,ecornell.cornell.edu,3930000000,1.09,us,en,1
40,AI marketing,41,How AI Has Changed Marketing Forever,How AI tools are shaping digital marketing strategies. What Will Happen to Marketing in the Age of AI?,https://www.youtube.com/watch?v=4OwG5ZYWzks,www.youtube.com,3930000000,1.09,us,en,172
41,AI marketing,42,Cognitiv: Artificial Intelligence Marketing Company,"Cognitiv's products are built on our proprietary Deep Learning Advertising Platform, offering marketers a comprehensive solution for creating and deploying AI- ...",https://www.cognitiv.ai/,www.cognitiv.ai,3930000000,1.09,us,en,1
42,AI marketing,43,22 Best AI Marketing Tools in 2025,"This guide delves into the significance of AI tools and reviews 21 best AI marketing tools you can leverage to cut costs, speed up workflows, improve ...",https://improvado.io/blog/best-ai-marketing-tools,improvado.io,3930000000,1.09,us,en,2
43,AI marketing,44,FounderPal — AI Marketing Platform to Grow Your Business,An AI marketing platform that is available 24/7 to GROW your business. It understands your context. It knows what's working in your industry. It is made for ...,https://founderpal.ai/,founderpal.ai,3930000000,1.09,us,en,1
44,AI marketing,45,13 Popular AI Marketing Tools You Should Use in 2025,"The right AI marketing tool should help with time-consuming duties like ideation, content writing, or task management. Thus saving you time and amping up your ...",https://planable.io/blog/ai-marketing-tools/,planable.io,3930000000,1.09,us,en,1
45,AI marketing,46,Artificial Intelligence Marketing - Albert,"Albert AI technology enables true creative optimization driven by real-time creative performance across products, ads, campaigns, and market segments.",https://albert.ai/,albert.ai,3930000000,1.09,us,en,1
46,AI marketing,47,"Marketing Artificial Intelligence: AI, Marketing, and the ...","Marketing AI Institute's Founder & CEO, Paul Roetzer, and Chief Content Officer, Mike Kaput, join forces to show marketers how to embrace AI and make it their ...",https://www.amazon.com/Marketing-Artificial-Intelligence-Future-Business/dp/1637740794,www.amazon.com,3930000000,1.09,us,en,1
47,AI marketing,48,AI marketing: What does the future hold?,"The good news is that marketers can immediately integrate machine learning and AI marketing tools into their existing marketing automation stack, including ...",https://www.sas.com/en_us/insights/articles/marketing/ai-marketing-what-does-the-future-hold.html,www.sas.com,3930000000,1.09,us,en,1
48,AI marketing,49,I paid $20 for an AI marketing agent - and here's what it got ...,"My findings and recommendations might surprise you, but not for the reason you think. In this article, I will share what AI marketing agents are ...",https://www.zdnet.com/article/i-paid-20-for-an-ai-marketing-agent-and-heres-what-it-got-me/,www.zdnet.com,3930000000,1.09,us,en,1
49,AI marketing,50,The AI Marketing Canvas,"By way of guidance, Venkatesan and Lecinski provide examples of brands—including Google, Lyft, Ancestry.com, and Coca-Cola—that have successfully woven AI into ...",https://www.sup.org/books/business/ai-marketing-canvas,www.sup.org,3930000000,1.09,us,en,1
50,AI marketing,51,The Ultimate Guide to AI Marketing,AI marketing is the use of artificial intelligence and machine learning (ML) to automate or advance a range of marketing tasks.,https://www.braze.com/resources/articles/ultimate-guide-to-ai-marketing,www.braze.com,3930000000,1.09,us,en,1
51,AI marketing,52,Artificial intelligence marketing,In real time AI has been used by Marketing professionals because they claim it helps them prioritize customer satisfaction. Marketing Professionals can analyze ...,https://en.wikipedia.org/wiki/Artificial_intelligence_marketing,en.wikipedia.org,3930000000,1.09,us,en,1
52,AI marketing,53,AI Marketing Strategy,Key Features ·. Transform your marketing into a masterpiece. Use AI-driven marketing tactics from industry leaders. ·. Execute your marketing plan with AI.,https://www.semrush.com/apps/ai-marketing-strategy/,www.semrush.com,3930000000,1.09,us,en,3
53,AI marketing,54,"AI in marketing: Benefits, strategies, and examples (2025 guide)","we'll explore how AI can be used by marketers to achieve different goals — like improving productivity, accurately predicting customer behaviors ...",https://useinsider.com/ai-in-marketing/,useinsider.com,3930000000,1.09,us,en,2
54,AI marketing,55,Best Examples of AI in Marketing,"Artificial intelligence is a game changer for marketers as it helps personalize, optimize and automate many key marketing activities.",https://digitalmarketinginstitute.com/blog/some-inspiring-uses-of-ai-in-digital-marketing,digitalmarketinginstitute.com,3930000000,1.09,us,en,2
55,AI marketing,56,AI in marketing revenue worldwide 2020-2028,The market for artificial intelligence (AI) in marketing was estimated at 15.84 billion US dollars. The source projected that the value would increase to more ...,https://www.statista.com/statistics/1293758/ai-marketing-revenue-worldwide/,www.statista.com,3930000000,1.09,us,en,2
56,AI marketing,57,Lewis Road using AI for marketing : r/newzealand,"Lewis Road using AI for marketing. Discussion. IDK this feels really off. For a company trying to market themselves as 'luxury', this is ...",https://www.reddit.com/r/newzealand/comments/1jwhonk/lewis_road_using_ai_for_marketing/,www.reddit.com,3930000000,1.09,us,en,4
57,AI marketing,58,Instantly.ai - Sales Engagement & Lead Intelligence,“I've specialised in cold email marketing since 2018 and in this time I've used almost every popular cold-emailing tool available on the market today - ...,https://instantly.ai/,instantly.ai,3930000000,1.09,us,en,1
58,AI marketing,59,AI in marketing: A complete guide,What are the benefits of AI in marketing? ... Generative AI helps marketers deliver highly personalized content and recommendations to every ...,https://www.sap.com/resources/ai-in-marketing,www.sap.com,3930000000,1.09,us,en,1
59,AI marketing,60,Google Ads - Get Customers and Sell More with Online ...,"Does Google Ads use AI? Yes, Google's AI-powered ad solutions help take your marketing further by helping you find new customers, build creative, unlock ...",https://business.google.com/us/google-ads/,business.google.com,3930000000,1.09,us,en,3
60,AI marketing,61,Blaze | The AI Tool for Teams of One,"Produce blog posts, social media content, ad copy, and marketing briefs - all in your brand voice.",https://www.blaze.ai/,www.blaze.ai,3930000000,1.09,us,en,1
61,AI marketing,62,Future proof your business with GTM AI,"Infuse AI across your go-to-market engine with a single platform — not dozens of copilots and point solutions. Codify best practices, unify data, connect teams, ...",https://www.copy.ai/,www.copy.ai,3930000000,1.09,us,en,3
62,AI marketing,63,What is AI Marketing? | Globant Tech Terms,AI in marketing enhances customer retention by deeply analyzing customer behavior and preferences. This data-driven approach enables businesses to tailor ...,https://www.globant.com/tech-terms/ai-marketing,www.globant.com,3930000000,1.09,us,en,1
63,AI marketing,64,Zeta Global – The AI Marketing Cloud,"Zeta's AI-powered marketing platform delivers measurable results and lowers tech ownership costs, giving CMOs and CFOs a clear path to higher ROI.",https://zetaglobal.com/,zetaglobal.com,3930000000,1.09,us,en,1
64,AI marketing,65,AI marketing: A guide to using AI in your marketing strategy,"In this guide, I'll unpack what AI marketing really means and how you can utilize it to do human-grade work, saving you time and bringing your campaigns to ...",https://zapier.com/blog/ai-marketing/,zapier.com,3930000000,1.09,us,en,3
65,AI marketing,66,7 AI Marketing Trends for 2024 & What They Mean for You,1. Further refinement of ad targeting. Many marketers are using AI for improved ad targeting. Artificial intelligence can parse through large sets of audience ...,https://www.wordstream.com/blog/ai-marketing-trends-2024,www.wordstream.com,3930000000,1.09,us,en,2
66,AI marketing,67,The State of AI: Global survey,"Respondents most often report using the technology in the IT and marketing and sales functions, followed by service operations. The business ...",https://www.mckinsey.com/capabilities/quantumblack/our-insights/the-state-of-ai,www.mckinsey.com,3930000000,1.09,us,en,2
67,AI marketing,68,"AI Agents for SEO, Content & GEO: Rank Higher | Writesonic",Your Marketing Tools Don't Talk To Each Other. ‍Our AI Connects Them All. · Research/Planning · Generate · Optimize · Publish.,https://writesonic.com/,writesonic.com,3930000000,1.09,us,en,4
68,AI marketing,69,Ai Marketing Tools - Supercharge your Advertising with ...,"How Leonardo.Ai Helps You Achieve Your Marketing Goals. Leonardo's AI tools help marketers and advertisers produce high quality images for landing pages, blogs, ...",https://leonardo.ai/ai-marketing-tools/,leonardo.ai,3930000000,1.09,us,en,1
69,AI marketing,70,Typeface | Personalized Marketing AI Platform for Enterprises,"An intuitive space designed for how marketers create ... Create anything you envision - from social posts to sizzle videos - in one space, while tracking projects ...",https://www.typeface.ai/,www.typeface.ai,3930000000,1.09,us,en,1
70,AI marketing,71,5 AI marketing predictions for 2025,"AI will be used to simulate ad performance. In 2025, AI will mature as a tool to help marketers improve advertising performance, according to ...",https://adage.com/article/special-report-business-forecast/5-ai-marketing-predictions-2025/2596726/,adage.com,3930000000,1.09,us,en,1
71,AI marketing,72,Attentive | AI-Powered SMS and Email Marketing Platform,"Your data. Their journey. Real results. · Personalized messages at scale · Elevate your marketing with real-time, AI-powered data activation. Explore Attentive ...",https://www.attentive.com/,www.attentive.com,3930000000,1.09,us,en,1
72,AI marketing,73,Pencil - Make Ads That Work,Make ads twice as fast with generative AI. Halve your costs and double your ad performance - without compromising on quality.,https://www.trypencil.com/,www.trypencil.com,3930000000,1.09,us,en,1
73,AI marketing,74,Marketing's New Middleman: AI Agents,"From discovery to decision, large language models are starting to gatekeep the marketing funnel, so brand stewards must learn to speak their ...",https://www.bain.com/insights/marketings-new-middleman-ai-agents/,www.bain.com,3930000000,1.09,us,en,2
74,AI marketing,75,What is Artificial Intelligence (AI) Marketing? A Complete ...,AI marketing is a method of leveraging customer data and AI concepts like machine learning to anticipate your customer's next move and improve the customer ...,https://emarsys.com/learn/blog/artificial-intelligence-marketing-solutions/,emarsys.com,3930000000,1.09,us,en,2
75,AI marketing,76,Levitate - Relationship Marketing as Authentic as You Are,"Our Happiness Platform combines authentic communication tools, dedicated success specialists and AI to help you build lasting relationships.",https://www.levitate.ai/,www.levitate.ai,3930000000,1.09,us,en,1
76,AI marketing,77,Qualified: Welcome to the Era of Agentic Marketing with Piper ...,"Marketers, meet your new favorite agent: Piper the AI SDR. She automates your entire inbound motion, delivering personalized experiences at hyperscale.",https://www.qualified.com/,www.qualified.com,3930000000,1.09,us,en,1
77,AI marketing,78,OpenAI,"PaperBench: Evaluating AI's Ability to Replicate AI Research. Publication Apr 2, 2025. nonprofit commission guidance > cover image. New commission to provide ...",https://openai.com/,openai.com,3930000000,1.09,us,en,1
78,AI marketing,79,Adobe GenStudio for Performance Marketing,"Create on-brand marketing content at scale and leverage generative AI to drive impactful, personalized campaigns with Adobe GenStudio for Performance ...",https://business.adobe.com/products/genstudio-for-performance-marketing.html,business.adobe.com,3930000000,1.09,us,en,2
79,AI marketing,80,It's Time for Marketers to Move Beyond the Linear Funnel,Redesign marketing plans to maximize the influence you can deliver across these channels. Execute with AI. Assess the maturity of the ...,https://www.bcg.com/publications/2025/move-beyond-the-linear-funnel,www.bcg.com,3930000000,1.09,us,en,2
80,AI marketing,81,"AI market projected to hit $4.8 trillion by 2033, emerging as ...",A new UN Trade and Development (UNCTAD) report projects the global AI market will soar from $189 billion in 2023 to $4.8 trillion by 2033 – a 25 ...,https://unctad.org/news/ai-market-projected-hit-48-trillion-2033-emerging-dominant-frontier-technology,unctad.org,3930000000,1.09,us,en,1
81,AI marketing,82,"#1 Leader in Individualized, Cross-Channel CX — Insider","#1 AI-native. Omnichannel Experience and Customer Engagement Platform · Trusted by marketing teams at 1,200+ brands, · You are in good company · One platform, ...",https://useinsider.com/,useinsider.com,3930000000,1.09,us,en,2
82,AI marketing,83,The state of AI in 2023: Generative AI's breakout year,"The most commonly reported uses of generative AI tools are in marketing and sales, product ... artificial intelligence, both with gen AI and more ...",https://www.mckinsey.com/capabilities/quantumblack/our-insights/the-state-of-ai-in-2023-generative-ais-breakout-year,www.mckinsey.com,3930000000,1.09,us,en,2
83,AI marketing,84,How Gen AI Is Transforming Market Research,"Survey data shows 45% of market researchers already use gen AI, with most employing it to analyze transcripts and data. While acknowledging ...",https://business.columbia.edu/insights/digital-future/ai/generative-ai-market-research,business.columbia.edu,3930000000,1.09,us,en,1
