created_at,edit_history_tweet_ids,text,conversation_id,id,lang,public_metrics.retweet_count,public_metrics.reply_count,public_metrics.like_count,public_metrics.quote_count,public_metrics.bookmark_count,public_metrics.impression_count,username
2022-10-31T14:15:00.000Z,['1587085734686720001'],"Mayhem is back! And just in time for College Football. Which means, we need to see your rituals for keeping our teams safe from Mayhem on game-day. Check out @KirkHerbstreit’s strategy, and share yours on TikTok with #AvoidMayhemWithAllstate and tag @Allstate. https://t.co/thOz3FuyzE",1587085734686720001,1587085734686720001,en,0,10,3,1,0,0,Allstate
2022-10-26T18:04:27.000Z,['1585331537314299928'],Make sure you have good hands working for you after #Ian. Check &amp; verify credentials of any contractors. See more #hurricanerecovery tips: https://t.co/WOFiAADbab https://t.co/KdJx6ZWm0r,1585331537314299928,1585331537314299928,en,1,10,2,1,0,0,Allstate
2022-10-01T20:36:28.000Z,['1576310096367390722'],"We’re helping those affected by #Hurricane #Ian at our Mobile Claims Centers in #Florida. You’ll meet with catastrophe personnel, get answers to questions and file claims. Locations: https://t.co/M5RfoWwTOO https://t.co/AQBCCtnOd0",1576310096367390722,1576310096367390722,en,6,25,12,1,0,0,Allstate
2022-09-29T19:06:16.000Z,['1575562623973818382'],"#Carolinas &amp; #Georgia, stay ready as the aftermath of #Hurricane #Ian makes landfall. Safety tips here: https://t.co/0YC6W9EoGx",1575562623973818382,1575562623973818382,en,2,6,3,0,0,0,Allstate
2022-09-28T21:51:02.000Z,['1575241698036355072'],"We’ll be there after the storm. Our Mobile Claims Centers are staged close by, ready to enter when it's deemed safe. File claims now at 1-800-54-STORM, the Allstate Mobile app or at https://t.co/DoaiZtXizo #Hurricane #Ian https://t.co/gn8Cea29U9",1575241698036355072,1575241698036355072,en,2,10,7,0,0,0,Allstate
2022-09-28T19:57:01.000Z,['1575213008028143616'],"We’re here to help after #Hurricane #Ian. To file an immediate claim, call 1-800-54-STORM, go to the Allstate® Mobile app, or visit: https://t.co/XUyzzIieL5 https://t.co/pGIRtOYbP7",1575213008028143616,1575213008028143616,en,1,7,1,0,0,0,Allstate
2022-09-26T18:30:35.000Z,['1574466480795783177'],"#HurricaneIan is quickly approaching. #Florida, stay ready ahead of the storm with an evacuation plan: https://t.co/S7pqyaSc4i",1574466480795783177,1574466480795783177,en,3,5,1,0,0,0,Allstate
2022-09-20T16:25:00.000Z,['1572260549328572416'],You can’t control the storm. But the right insurance may help your peace of mind. https://t.co/vNX89GaXjJ,1572260549328572416,1572260549328572416,en,1,6,1,1,0,0,Allstate
2022-09-19T19:01:40.000Z,['1571937587023020032'],These college athletes take it to the next level on AND OFF the field. Read their stories &amp; vote for captain of the 2022 Allstate AFCA Good Works team! @WeAreAFCA 🏈 https://t.co/JuJHju8OOF,1571937587023020032,1571937587023020032,en,1,6,5,0,0,0,Allstate
2022-09-09T14:47:54.000Z,['1568249843805470721'],"As the #FairviewFire blazes, stay safe with an evacuation plan: https://t.co/ICxMjTWF9j. Start claims via Allstate Mobile or call 1-800-54-STORM. https://t.co/T1HJYOKp9X",1568249843805470721,1568249843805470721,en,0,5,1,0,0,0,Allstate
2022-09-06T20:33:32.000Z,['1567249663073320960'],"If you've been impacted by the #MillFire, start claims via the Allstate Mobile app or call 1-800-54-STORM. Stay safe &amp; visit Allstate's Disaster Help Center for recovery info: https://t.co/g0O7yrB2bJ https://t.co/AGgn7T4nil",1567249663073320960,1567249663073320960,en,1,1,1,0,0,0,Allstate
2022-09-02T17:50:32.000Z,['1565759092890763266'],good hands,1565759092890763266,1565759092890763266,en,4,9,9,1,0,0,Allstate
2022-09-01T18:15:01.000Z,['1565402864645709824'],We are proud to announce this season #Allstate will become a Championship Partner for Notre Dame Athletics @FightingIrish https://t.co/9udKanIf8s https://t.co/MiRX71H8kH,1565402864645709824,1565402864645709824,en,2,5,12,1,0,0,Allstate
2022-08-04T00:54:00.000Z,['1554994022539739138'],"Our hearts go out to those affected by the #McKinneyWildfire. To file a claim, visit the Allstate Mobile App or call 1-800-54-STORM: https://t.co/Avjn5IjLLn https://t.co/tpweO1RPXm",1554994022539739138,1554994022539739138,en,1,16,5,0,0,0,Allstate
2022-07-26T22:40:14.000Z,['1552061257674592257'],"You should never have to face trouble alone. If you’ve been affected by the #fires, start your claim at 1-800-54-STORM or via the Allstate Mobile App. Learn more with Allstate’s Disaster Recovery Guide: https://t.co/DFRhNI96UQ https://t.co/TTdApdkCJV",1552061257674592257,1552061257674592257,en,2,17,6,0,0,0,Allstate
2022-07-21T21:20:02.000Z,['1550229133791215617'],As a proud sponsor of the #USWNT we want to congratulate @uswnt for recently qualifying for Paris 2024! We’ll be cheering for them along the way. https://t.co/ZUDje1dSrJ,1550229133791215617,1550229133791215617,en,12,12,199,1,2,0,Allstate
