text,lang,conversation_id,edit_history_tweet_ids,created_at,id,public_metrics.retweet_count,public_metrics.reply_count,public_metrics.like_count,public_metrics.quote_count,public_metrics.bookmark_count,public_metrics.impression_count,article.title,in_reply_to_user_id,username
"The food on your plate may not be as nourishing as you think.

Over the last fifty years, conventional farming practices have stripped our soil of vital nutrients, and the result is food that can contain up to 50% fewer vitamins and minerals than it once did.

Same calories. https://t.co/4PWgO3OYax",en,2023395786277453898,['2023395786277453898'],2026-02-16T13:55:22.000Z,2023395786277453898,62,30,398,6,44,18251,,,drmarkhyman
"I’m proud to have contributed to the new Evidence-Based Prevention Continuum, a framework designed to help move preventive interventions from early evidence to broad adoption in Medicare, Medicaid, and private health plans.

Grateful to collaborate with leaders across CMS",en,2022361473578864697,['2022361473578864697'],2026-02-13T17:25:23.000Z,2022361473578864697,8,12,99,0,4,6121,,,drmarkhyman
"Today is a big day. Food Fix Uncensored is officially out in the world, and I’m thrilled to share it with you 🎉 grab your copy here: https://t.co/LPIwxUJQnl

This is the most urgent, unfiltered book I’ve written, and if you feel called to support this message, I hope you’ll https://t.co/PescCH6Elw",en,2021270390488883241,['2021270390488883241'],2026-02-10T17:09:49.000Z,2021270390488883241,13,29,166,2,12,8288,,,drmarkhyman
100%! https://t.co/Wez0pArbFk,und,2020990372080648602,['2020990372080648602'],2026-02-09T22:37:07.000Z,2020990372080648602,7,2,58,0,7,13882,,,drmarkhyman
This may be the most powerful ad I've ever seen. Thank you @MikeTyson https://t.co/uKtD6rxHWc,en,2020200397277938025,['2020200397277938025'],2026-02-07T18:18:02.000Z,2020200397277938025,107,12,1272,1,35,40765,,,drmarkhyman
"True healthcare starts with addressing the root cause, not masking symptoms with prescriptions. 

If your doctor isn’t asking about your diet, sleep, exercise, hydration, or stress, you’re not getting healthcare—you’re getting disease management. 

It’s time to demand better. https://t.co/3Z24w1KPL6",en,2019521941401403627,['2019521941401403627'],2026-02-05T21:22:06.000Z,2019521941401403627,59,22,259,7,36,8390,,,drmarkhyman
"This goes to show that what we choose at the store shapes the food landscape. When demand for ultra-processed snacks softens, companies respond with changes in price, formulation, and marketing. That doesn’t make these foods healthy, and they’re still not what I’d choose at the",en,2019188220588876239,['2019188225118728330'],2026-02-04T23:16:02.000Z,2019188225118728330,0,6,33,0,0,3247,,18027434,drmarkhyman
"PepsiCo is also chasing trends people care about, releasing Doritos with added protein and Lay’s chips made with avocado or olive oil, planning a low-sugar Gatorade without artificial ingredients, and revamping Quaker marketing to emphasize fiber and whole grains.",en,2019188220588876239,['2019188223331955077'],2026-02-04T23:16:01.000Z,2019188223331955077,1,3,75,0,0,5729,,18027434,drmarkhyman
"Something interesting is happening in the snack aisle. 

PepsiCo just reported that the volume of food sold in North America fell by about 1% last quarter. In other words, fewer products are moving off shelves, and Big Food is paying attention...",en,2019188220588876239,['2019188221956223406'],2026-02-04T23:16:01.000Z,2019188221956223406,1,2,49,0,1,2893,,18027434,drmarkhyman
"Chip sales are down and suddenly Big Food is “reformulating.”

Turns out when people stop buying ultra-processed food, the industry adapts fast. Consumer choice is a powerful lever. https://t.co/9BPS3xu6NP",en,2019188220588876239,['2019188220588876239'],2026-02-04T23:16:01.000Z,2019188220588876239,26,24,241,5,6,9868,,,drmarkhyman
"Ozempic and other GLP1 drugs have been helpful for a lot of people. But when you start prescribing them to nearly 40 million Americans, you have to expect complications and side effects, like with any medication.

About 4% of people experience serious gastrointestinal https://t.co/nhUtQO1hjI",en,2018474961628012917,['2018474961628012917'],2026-02-03T00:01:46.000Z,2018474961628012917,30,29,230,2,40,39414,,,drmarkhyman
"Aging isn’t something to “fix.” It’s something to understand.

I’m honored to be speaking at the @Livelong_Media  Women’s Health Summit, a gathering focused on clear, grounded conversations about women’s health.

📍 April 17–18, 2026 | San Francisco

Grab your tickets here: https://t.co/UfzJ9UO7Zv",en,2017280219787534549,['2017280219787534549'],2026-01-30T16:54:18.000Z,2017280219787534549,2,4,40,1,4,6598,,,drmarkhyman
"The Ozempic conversation everyone needs to hear. 

Thanks for having me @ChrisCuomo https://t.co/PmDFo99Yr7",en,2016964502735224945,['2016964502735224945'],2026-01-29T19:59:45.000Z,2016964502735224945,32,15,227,7,155,44652,,,drmarkhyman
"TONIGHT: I join @ChrisCuomo on #CUOMO. Tune in at 8p/7C on @NewsNation. To find your channel, visit https://t.co/cnnuWlYObc https://t.co/3ELa6iBwQD",en,2016677301187236098,['2016677301187236098'],2026-01-29T00:58:31.000Z,2016677301187236098,1,5,15,1,1,5456,,,drmarkhyman
"Honored to join @CBSNews as a contributor, bringing evidence-based insights on health, nutrition, and disease prevention to a broader audience. Stay tuned! https://t.co/sPRche59gX",en,2016222062692729067,['2016222062692729067'],2026-01-27T18:49:33.000Z,2016222062692729067,19,35,434,0,14,30183,,,drmarkhyman
"The future of medicine isn't found in a pill bottle. It's found in what you put on your plate, how you move your body, the quality of your sleep, and your ability to manage stress. 

It's about understanding that your body is a self-healing, self-regulating organism when you give https://t.co/Nk5g9q1qwW",en,2015038875840966751,['2015038875840966751'],2026-01-24T12:28:00.000Z,2015038875840966751,76,24,356,7,49,12762,,,drmarkhyman
"The average American consumes 55 pounds of added sugar each year, which we know is a major contributor towards the diabesity epidemic. ⁣

In fact, poor diet is responsible for almost 700,000 deaths in the US each year, and 11 million worldwide! 
⁣
The good news is that each",en,2014771951760511381,['2014771953111073044'],2026-01-23T18:47:20.000Z,2014771953111073044,7,2,52,0,6,7397,,18027434,drmarkhyman
"When you eat the standard American diet, you get the standard American diseases.

- Ocean Robbins",en,2014771951760511381,['2014771951760511381'],2026-01-23T18:47:20.000Z,2014771951760511381,14,8,127,2,8,8312,,,drmarkhyman
"79 ingredients in a Pizza Roll... 😵‍💫

When I look at these ingredient lists, I don't see food. I see laboratory formulations engineered with precision.

This is what an entire generation grew up eating. And tragically, we're still feeding these same products to children today, https://t.co/pArxygSRgQ",en,2014488230952079719,['2014488230952079719'],2026-01-22T23:59:56.000Z,2014488230952079719,174,67,847,16,80,31842,,,drmarkhyman
"Lunch today! Standing here at @sweetgreen looking at this menu is incredible 😋

Never thought I'd walk into a restaurant and see meals I designed with @function on the menu! Real food built on nutrient principles and decades of medical research that actually supports how your https://t.co/rakgnBH8En",en,2013745308090671497,['2013745308090671497'],2026-01-20T22:47:49.000Z,2013745308090671497,18,19,448,3,26,30092,,,drmarkhyman
"This case decides if our system protects people or profits.

If you believe transparency matters. If you think faking studies is wrong. If you think cancer patients deserve their day in court…

Pay attention to this one. Case: Monsanto v. Durnell | Decision: June 2026",en,2013314984131149857,['2013314993446625774'],2026-01-19T18:17:54.000Z,2013314993446625774,2,5,31,0,4,3377,,18027434,drmarkhyman
"What’s happening next:

The Supreme Court will decide by June 2026: can corporations hide behind government approval even when people get sick?

Should companies that ghostwrite safety studies and face 181,000 cancer lawsuits be immune because the EPA said okay?

That's the",en,2013314984131149857,['2013314992033145309'],2026-01-19T18:17:54.000Z,2013314992033145309,1,1,14,0,0,3503,,18027434,drmarkhyman
"Why this matters for you:

This decision will set precedent for every pesticide case moving forward, determining whether accountability still exists.

The EPA reviews chemicals every 15 years using mostly company-funded research. If that's the only system and lawsuits disappear,",en,2013314984131149857,['2013314990460280891'],2026-01-19T18:17:53.000Z,2013314990460280891,1,3,12,0,0,341,,18027434,drmarkhyman
"What’s at stake?
If Bayer wins, companies get immunity as long as the EPA approved them—even if:

- Independent science shows harm
- They faked their safety studies
- People actually got cancer
- Juries found them guilty

Right now, you can sue if a product hurts you. This case",en,2013314984131149857,['2013314988841308551'],2026-01-19T18:17:53.000Z,2013314988841308551,1,1,12,0,0,398,,18027434,drmarkhyman
"The science it split:

The EPA says Roundup is safe.
The World Health Organization says it's ""probably carcinogenic.""

Why? Roundup's maker literally ghostwrote their own ""independent"" safety studies, then had scientists sign their names to them.

The EPA's approval process",en,2013314984131149857,['2013314987314552923'],2026-01-19T18:17:53.000Z,2013314987314552923,7,1,31,0,1,3047,,18027434,drmarkhyman
"Here’s the situation:

People who used Roundup weedkiller developed non-Hodgkin's lymphoma. They took the company to court. Juries sided with them, awarding billions in compensation, including one recent verdict of $2.1 billion.

But now, Bayer (who makes Roundup) is asking the",en,2013314984131149857,['2013314985657860217'],2026-01-19T18:17:52.000Z,2013314985657860217,6,2,20,1,3,3186,,18027434,drmarkhyman
"181,000 people are suing Roundup for cancer. Juries awarded them billions. Now, the Supreme Court might shut it all down.",en,2013314984131149857,['2013314984131149857'],2026-01-19T18:17:52.000Z,2013314984131149857,20,4,57,0,10,6813,,,drmarkhyman
"If you eat like crap, you’ll feel like crap. Your body is a complicated biochemical hormonal soup controlled mostly by what you eat; the information in food can literally upgrade or downgrade your biological software with every bite. 

Changing the way that you eat for the https://t.co/1H2gnk9Avu",en,2013229521021911225,['2013229521021911225'],2026-01-19T12:38:16.000Z,2013229521021911225,96,29,578,9,103,35168,,,drmarkhyman
"Send this to someone you’re on your health journey with. 

Every meal, every workout, every night’s sleep—it’s all building the future you. What you do now, in your 20s, 30s, and even 50s, shapes the health you’ll experience in the decades to come.

To understand why the choices https://t.co/nqsgRpkimg",en,2012926733142376704,['2012926733142376704'],2026-01-18T16:35:06.000Z,2012926733142376704,63,21,297,9,59,28177,,,drmarkhyman
The diet industry made $78 billion last year... Yet 95% of diets fail within 5 years. Make it make sense?,en,2012230014390170034,['2012230014390170034'],2026-01-16T18:26:35.000Z,2012230014390170034,7,16,79,0,6,8825,,,drmarkhyman
"A brand new Cochrane review of 73 studies involving nearly 5,000 people found that exercise may be as effective as antidepressants and psychological therapy for reducing symptoms of depression.

Adverse events from exercise were rare—while antidepressants commonly cause side",en,2011832283150631266,['2011832283150631266'],2026-01-15T16:06:08.000Z,2011832283150631266,52,51,264,9,54,159768,,,drmarkhyman
"Every supermarket is a battlefield for your health. They have psychologists. You need strategy.

Food Fix  Uncensored decodes every trick, trap, and manipulation tactic designed to fill your cart with disease.

Know the battlefield. Win the war. https://t.co/K5Ft8zhf7X",en,2011213466972115212,['2011213476656812107'],2026-01-13T23:07:14.000Z,2011213476656812107,0,0,23,0,3,3728,,18027434,drmarkhyman
"How to shop like you're in enemy territory:

- Shop the perimeter only—avoid center aisles
- Never shop hungry—eat before entering
- Use a list—no deviations
- Wear headphones—block manipulation music
- Set timer for 30 minutes—get out fast

Treat it like a mission, not a stroll.",en,2011213466972115212,['2011213475016741080'],2026-01-13T23:07:13.000Z,2011213475016741080,2,2,36,1,5,4288,,18027434,drmarkhyman
