text,lang,conversation_id,edit_history_tweet_ids,created_at,id,public_metrics.retweet_count,public_metrics.reply_count,public_metrics.like_count,public_metrics.quote_count,public_metrics.bookmark_count,public_metrics.impression_count,article.title,in_reply_to_user_id,username
"Many people assume eating healthy on a tight budget isn’t realistic. I understand why.

SNAP benefits average about $6 per person, per day. That has to cover every meal, often with limited time, access, and resources.

So we decided to show what’s actually possible.

We’re eating https://t.co/Cq3mJ5OGQ2",en,2042717859609211128,['2042717859609211128'],2026-04-10T21:34:24.000Z,2042717859609211128,9,5,87,0,56,8760,,,drmarkhyman
"Do life insurance companies know exactly when you’re going to die?

It sounds like science fiction, but it’s actually data. They’ve spent decades collecting data on blood biomarkers, nutrient levels, and lifestyle factors that predict mortality with stunning accuracy. Their risk https://t.co/3oOesOSh3m",en,2042184592308785240,['2042184592308785240'],2026-04-09T10:15:23.000Z,2042184592308785240,20,4,80,2,77,11812,,,drmarkhyman
https://t.co/TH07nBNTl5,zxx,2041586894912549041,['2041586894912549041'],2026-04-07T18:40:21.000Z,2041586894912549041,14,8,88,2,77,13869,Unlocking the Secrets of Resistant Starch for Health and Longevity,,drmarkhyman
"How LOVE is MEDICINE 🔈⬆️

Love is so powerful, that it can literally change your gene expression. 

Science tells us that our social connections, whether with loved ones or through a strong sense of community, can directly influence our gene expression—a field known as https://t.co/eqdOrZ9lpq",en,2041159836847448350,['2041159836847448350'],2026-04-06T14:23:22.000Z,2041159836847448350,42,10,197,2,56,10585,,,drmarkhyman
"You don't magically become healthy. You practice it. You notice you're making a bad choice and correct it, over and over again until the good one becomes automatic. The people who figured this out aren't special. They just decided to take it seriously one day and never stopped.",en,2041112934319849771,['2041112934319849771'],2026-04-06T11:17:00.000Z,2041112934319849771,32,31,431,3,46,11771,,,drmarkhyman
https://t.co/W3LQxcNfGW,zxx,2040945469107679530,['2040945469107679530'],2026-04-06T00:11:33.000Z,2040945469107679530,70,7,718,3,1833,150997,Two Workouts That Target the Root Cause of Almost EVERY Disease,,drmarkhyman
"You can reverse most of what you think is ""just aging"" in 90 days. You'd be surprised how fast your body changes when you stop fighting its biology and start working with it.",en,2040943483306000887,['2040943483306000887'],2026-04-06T00:03:39.000Z,2040943483306000887,37,15,694,4,372,114358,,,drmarkhyman
"In medical school, we’re taught the brain is immutable, that we can’t grow new brain cells or change the brain once dysfunction or injury has occurred. Now, we know that’s just not true. 

The decisions we make each and every day, like what we eat, how much sleep we get, and how https://t.co/LcEySE7Wcl",en,2040845949778428053,['2040845949778428053'],2026-04-05T17:36:06.000Z,2040845949778428053,18,11,152,1,35,8980,,,drmarkhyman
"What if preparing for pregnancy started long before trying to conceive?

Dr. Ann Shippy explains why the months before pregnancy may be one of the most important windows for shaping a child’s future health.

Nutrition, stress, environmental toxins, mitochondrial function, and the https://t.co/RWepzPb9kF",en,2040797195226497181,['2040797195226497181'],2026-04-05T14:22:22.000Z,2040797195226497181,18,6,162,1,122,26244,,,drmarkhyman
"What’s your favorite way to have cacao?

Dr. William Li explains how we can leverage food to optimize every system of the body. Here, he explains the many benefits of incorporating cacao into your diet. 

Find the full conversation on The Dr. Hyman Show wherever you listen to https://t.co/Q0fdlisodM",en,2040386736304357561,['2040386736304357561'],2026-04-04T11:11:21.000Z,2040386736304357561,20,16,129,0,80,14468,,,drmarkhyman
Why does your doctor check your cholesterol but not your insulin levels?,en,2040181528840564954,['2040181528840564954'],2026-04-03T21:35:55.000Z,2040181528840564954,110,248,1546,37,106,299751,,,drmarkhyman
What questions do you have about hormone replacement therapy (HRT)—and what’s been most confusing or frustrating about it?,en,2040102358622073191,['2040102358622073191'],2026-04-03T16:21:20.000Z,2040102358622073191,1,63,39,0,41,36690,,,drmarkhyman
"This is the kind of consolidation I've been warning about for years. A food system controlled by fewer and fewer hands affects both what's in your wallet and what's actually in your food — where it comes from and who has access to real nutrition.

But here's what I know to be",en,2039844264285524452,['2039844276851610037'],2026-04-02T23:15:48.000Z,2039844276851610037,1,1,17,1,4,3346,,18027434,drmarkhyman
"When one company controls distribution at this scale, there is little incentive to prioritize fresh, local, or nutritious food over what's cheapest and most profitable

That's how consolidation has worked every time before.",en,2039844264285524452,['2039844275161317647'],2026-04-02T23:15:48.000Z,2039844275161317647,0,3,13,0,0,2932,,18027434,drmarkhyman
"Sysco acquiring Restaurant Depot will significantly reduce the alternatives available to where America's independent restaurants, schools, and hospitals source their food…

725,000+ operators with very few alternatives…",en,2039844264285524452,['2039844273596805414'],2026-04-02T23:15:47.000Z,2039844273596805414,2,1,15,0,1,2766,,18027434,drmarkhyman
"Restaurant Depot was one of the key alternatives helping keep prices competitive

Small restaurant owners, school kitchen staff, and hospital cafeteria workers could walk into the warehouse, load their own carts, and pay rock-bottom prices — no delivery fees, no markups, no",en,2039844264285524452,['2039844271931719807'],2026-04-02T23:15:47.000Z,2039844271931719807,2,1,12,0,1,2554,,18027434,drmarkhyman
"In 2015, the FTC blocked Sysco from absorbing US Foods (its biggest competitor) over fears it would give one company too much control over what every restaurant, hospital, and cafeteria pays for food..",en,2039844264285524452,['2039844270304346114'],2026-04-02T23:15:47.000Z,2039844270304346114,1,1,10,0,1,2495,,18027434,drmarkhyman
Sysco already controls 17% of a $370 billion foodservice industry — and that's before this deal https://t.co/cIgR0rIUFQ,en,2039844264285524452,['2039844268215603236'],2026-04-02T23:15:46.000Z,2039844268215603236,0,2,8,1,0,2989,,18027434,drmarkhyman
"Sysco is the global leader in selling, marketing, and distributing food products to restaurants, healthcare/educational facilities, and lodging establishments.

They’re acquiring Restaurant Depot —a wholesale foodservice supplier that provides food, equipment, and supplies to",en,2039844264285524452,['2039844266793664902'],2026-04-02T23:15:46.000Z,2039844266793664902,0,3,17,0,2,4940,,18027434,drmarkhyman
"BREAKING: Sysco is acquiring Restaurant Depot for ~$29B

This could reshape how food moves in America… https://t.co/5hi5DzBaXc",en,2039844264285524452,['2039844264285524452'],2026-04-02T23:15:45.000Z,2039844264285524452,18,6,65,3,12,12184,,,drmarkhyman
"We must fix the food system and create a healthier nation.

It makes more sense to address the root cause of chronic disease and prevent healthcare interventions in the first place than to try and fix them after the fact.

In fact, cheap food turns out to be very, very expensive. https://t.co/ZvU84Z9k8l",en,2039342549840572786,['2039342549840572786'],2026-04-01T14:02:07.000Z,2039342549840572786,15,8,67,0,5,3643,,,drmarkhyman
"The next frontier in medicine, psychiatry, and neurology is realizing that depression is not a Prozac deficiency, ADHD is not a Ritalin deficiency, schizophrenia is not a Zyprexa deficiency, and heart disease is not a statin deficiency.",en,2039026353157374147,['2039026353157374147'],2026-03-31T17:05:40.000Z,2039026353157374147,117,45,688,5,113,38855,,,drmarkhyman
"You don’t need to overhaul everything.

Start where exposure is highest:
-Underwear
-Bras
-Activewear
-Sleepwear
-Choose simpler fabrics when possible. Be cautious with “stain-resistant” and “waterproof” claims.

Because what you wear can be part of your total chemical exposure,",en,2038767095069172011,['2038767107924697538'],2026-03-30T23:55:31.000Z,2038767107924697538,1,1,31,0,4,3713,,18027434,drmarkhyman
"Much of modern clothing is synthetic.

Polyester, nylon, elastane, acrylic

These materials can contain thousands of chemical compounds, many of which are still poorly characterized for long-term health effects.

As they wear and break down, they can also shed microplastics.",en,2038767095069172011,['2038767106054086863'],2026-03-30T23:55:31.000Z,2038767106054086863,2,1,21,0,4,3855,,18027434,drmarkhyman
"These chemicals are endocrine disruptors and can interfere with hormone signaling in the body.

They’ve been detected in:
- Plastic-based fabrics
- Synthetic dyes
- Stain-resistant and waterproof finishes
- Small exposures, repeated daily, can add up over time.",en,2038767095069172011,['2038767104493846532'],2026-03-30T23:55:30.000Z,2038767104493846532,0,1,8,0,0,540,,18027434,drmarkhyman
"Now add heat, sweat, and friction.

In lab studies simulating sweat, absorption of certain textile chemicals was increased by more than 3,000%.

This is exactly the environment created by tight, synthetic activewear.",en,2038767095069172011,['2038767102740574312'],2026-03-30T23:55:30.000Z,2038767102740574312,3,2,11,0,1,597,,18027434,drmarkhyman
"Your skin is a barrier, but for some chemicals it can also be a pathway.

- Certain chemicals can be absorbed through the skin and enter circulation.
- Unlike food, this exposure bypasses detox pathways.",en,2038767095069172011,['2038767100563771637'],2026-03-30T23:55:29.000Z,2038767100563771637,2,1,12,0,0,563,,18027434,drmarkhyman
"What researchers are actually finding in clothing:
BPA in athletic clothing at levels up to 40x ABOVE safety limits.

~90% of baby socks contain BPA
100% of stain-resistant preschool uniforms tested contained PFAS
Baby clothing shows some of the highest phthalate levels

This is",en,2038767095069172011,['2038767098672148894'],2026-03-30T23:55:29.000Z,2038767098672148894,6,2,45,1,7,3618,,18027434,drmarkhyman
"There are only 3 federal laws regulating clothing:
1. Requires fiber content labeling
2. Limits lead in children’s products
3. Requires certain garments to meet flammability rules

Clothing labels still don’t disclose most chemicals used in production.",en,2038767095069172011,['2038767096755339636'],2026-03-30T23:55:28.000Z,2038767096755339636,5,2,36,0,5,3744,,18027434,drmarkhyman
"Are your clothes exposing you to chemicals?

You wear them all day long, yet no one is talking about what’s IN them…",en,2038767095069172011,['2038767095069172011'],2026-03-30T23:55:28.000Z,2038767095069172011,10,17,96,3,26,14612,,,drmarkhyman
"This Orange Ginger Salmon en Papilotte recipe is so good and it’s easy to make. 

All you need is:
1 orange, zested and juiced
3 garlic cloves, microplaned
1-inch fresh ginger, microplaned
1 tablespoon toasted sesame seeds
¼ teaspoon sea salt
¼ cup coconut aminos or tamari
1 ½ https://t.co/b7jFnITxuh",en,2037909719449260372,['2037909719449260372'],2026-03-28T15:08:34.000Z,2037909719449260372,12,7,96,1,127,12304,,,drmarkhyman
"What if I told you there’s a powerful drug that can transform your health without a single side effect? 

That drug is not in a pill—it’s in your kitchen.

Food isn’t just calories—it’s a molecular signal that programs your biology in real time. Every bite you take sends https://t.co/ISAkjGitCq",en,2037679792967856351,['2037679792967856351'],2026-03-27T23:54:55.000Z,2037679792967856351,28,11,181,3,36,22522,,,drmarkhyman
"My Friday newsletter is one of my favorite things to put together.

It's called Mark's Picks — and every week it's just 5 things I'm genuinely excited about. Could be a book that's changing how I think, a supplement I've been researching, a gadget I've been using, or a health https://t.co/FwOEkdWIqS",en,2037662324136223092,['2037662324136223092'],2026-03-27T22:45:30.000Z,2037662324136223092,5,0,34,0,6,4824,,,drmarkhyman
"Before you biohack...

-Clean up your diet
-Regulate your sleep
-Balance your blood sugar
-Calm your nervous system
-Move daily
-Build relationships

You can’t out-hack the fundamentals.",en,2034393155798528055,['2034393155798528055'],2026-03-18T22:15:00.000Z,2034393155798528055,72,44,678,1,94,17349,,,drmarkhyman
"How to support your brain’s key signaling systems without a screen 🧠

These habits don’t directly “boost” a single chemical on demand, and they aren’t treatments for mental health or sleep disorders. But practiced consistently, they may help support the biological systems https://t.co/laaV7bW7Vh",en,2033587627912581154,['2033587627912581154'],2026-03-16T16:54:07.000Z,2033587627912581154,96,17,478,2,359,19244,,,drmarkhyman
"Did you know that getting sunlight before 10 a.m. can help reset your circadian rhythm and improve sleep quality?

Morning light acts as a powerful signal to your brain, helping synchronize your internal clock with the natural day–night cycle.",en,2033515623632732621,['2033515623632732621'],2026-03-16T12:08:00.000Z,2033515623632732621,46,38,519,4,52,14259,,,drmarkhyman
"A new study found that when adults blocked internet access on their smartphones for just 2 weeks, 91% improved their attention, mental health, or overall well-being

Your brain recalibrates faster than you think.",en,2033183434781122582,['2033183434781122582'],2026-03-15T14:08:00.000Z,2033183434781122582,586,73,4803,22,931,165968,,,drmarkhyman
"A study of more than 300,000
people found that meaningful connection is one of the strongest predictors of a long life.

Those who felt loved, supported, and socially connected had a 50% higher chance of survival - rising to 91% for those with rich, layered relationships.",en,2032790344790843656,['2032790344790843656'],2026-03-14T12:06:00.000Z,2032790344790843656,45,19,321,7,65,14725,,,drmarkhyman
"The solution is simple but radical: fix food, fix health, fix the planet.

Shifting to a diet of whole, real, and regeneratively grown foods could transform public health and heal the environment.",en,2032609329279545578,['2032609329279545578'],2026-03-14T00:06:42.000Z,2032609329279545578,44,24,420,5,13,13323,,,drmarkhyman
"I’ve been working with the team at Bioreset Medical for years, and they’ve become my go-to when something in my body isn’t working quite right.

They helped me tremendously with my back and a nagging knee issue, and they tuned me up again today. Feeling great.

If you’re dealing https://t.co/val0NNbj3z",en,2031765960533868757,['2031765960533868757'],2026-03-11T16:15:28.000Z,2031765960533868757,8,8,83,0,13,10655,,,drmarkhyman
"We treat our health like it’s infinite, until it’s not.

We push through exhaustion, fuel ourselves with processed food, and tell ourselves we’ll “get healthy later” once work slows down, once the kids are older, once we have more time.

But your health isn’t waiting for you to",en,2031552595739771070,['2031552595739771070'],2026-03-11T02:07:37.000Z,2031552595739771070,44,24,384,8,70,17475,,,drmarkhyman
"Any kind of systemic inflammation is going to affect every system in the body. It may manifest more in one particular anatomical area, but it affects the entire body.

Inflammation is tied in with arthritis and memory loss. Diabetes, high insulin levels, high glucose levels, https://t.co/L900eNct59",en,2031322446490477036,['2031322446490477036'],2026-03-10T10:53:06.000Z,2031322446490477036,27,16,131,1,51,7115,,,drmarkhyman
"🚩 Red flag: They think they already know everything.
🟩 Green flag: They’re still asking how to love you better.

In this conversation with @yung_pueblo, we explore how humility (or the lack of it) can make or break a relationship.

A rigid sense of identity often hides deep https://t.co/WoFyt1WjOx",en,2030955593586909547,['2030955593586909547'],2026-03-09T10:35:21.000Z,2030955593586909547,5,3,72,0,23,8857,,,drmarkhyman
"We’ve long separated mental health from brain health. But they are deeply connected.

Brain inflammation. Mitochondrial dysfunction. Oxidative stress. Neurotransmitter imbalances. These are biological disruptions that can profoundly affect mood, behavior, and cognition.

These https://t.co/e0t0cE6hiO",en,2030342892691046800,['2030342892691046800'],2026-03-07T18:00:42.000Z,2030342892691046800,45,31,233,11,60,12856,,,drmarkhyman
"""Ultra-processed foods should be treated more like cigarettes than food"" -- agreed! 

https://t.co/Wez0pArbFk",en,2030038816057348107,['2030038816057348107'],2026-03-06T21:52:24.000Z,2030038816057348107,43,16,288,6,11,45626,,,drmarkhyman
"Who you want to be and how you want to feel at 80 starts right now...

The choices you make today: what you eat, how you move, how you manage stress, determine the health of your brain, muscles, metabolism, and immune system decades from now.

Studies show that up to 90% of https://t.co/1FZq1vAomE",en,2029161207144309122,['2029161207144309122'],2026-03-04T11:45:06.000Z,2029161207144309122,32,21,236,2,40,9590,,,drmarkhyman
"My team at The UltraWellness Center is hiring for a Registered Nurse:

If you're ready to practice nursing with purpose in a setting that values both patients and team members, we encourage you to apply today.  https://t.co/h4dns29wwg",en,2028875105980526991,['2028875105980526991'],2026-03-03T16:48:14.000Z,2028875105980526991,4,3,23,0,2,6281,,,drmarkhyman
"A systematic review found a 44–53% higher risk of anxiety and depression for those who consume ultra-processed foods regularly.

https://t.co/uM9tzTFEtr",en,2028651825063505968,['2028651825063505968'],2026-03-03T02:01:00.000Z,2028651825063505968,18,8,71,3,24,8393,,,drmarkhyman
"Target just announced they will stop selling cereals with synthetic dyes by May 31.

It may not sound revolutionary. But standards set at this scale shape what’s available to millions of families. This is a meaningful step forward.

Thank you, @Target!

https://t.co/AbBpsx2KFx",en,2028613630967836764,['2028613630967836764'],2026-03-02T23:29:14.000Z,2028613630967836764,30,17,444,4,8,11902,,,drmarkhyman
Did you know that the “new-car smell” or the unfamiliar scent of new furniture can come from the off-gassing of formaldehyde and flame retardants? Both of which can release chemicals into the air and have been associated with brain toxicity and conditions like ALS?,en,2026844800046215301,['2026844800046215301'],2026-02-26T02:20:31.000Z,2026844800046215301,22,17,170,5,22,42939,,,drmarkhyman
"The science of neuroplasticity tells us the brain can rewire at any age — but it requires consistent new choices over time, not a single breakthrough.

Nicole's book, Reparenting the Inner Child, is a practical guide to doing that work. Worth reading slowly.

Listen to our full",en,2026732365230530641,['2026732375993143330'],2026-02-25T18:53:47.000Z,2026732375993143330,1,1,15,1,15,4384,,18027434,drmarkhyman
"The practices she recommends aren't complicated. 

Check in with your body throughout the day. Notice your jaw, your shoulders, your breathing. Slow your exhale. Move a little slower.

Done once, nothing happens. Done consistently, you start to actually shift your baseline.",en,2026732365230530641,['2026732373984059738'],2026-02-25T18:53:47.000Z,2026732373984059738,2,2,11,0,4,2453,,18027434,drmarkhyman
"Dr. LePera's reframe on anxiety stuck with me: it's not a chemical imbalance you were born with. For many people, it's a nervous system that never learned to come back to baseline — because no one modeled that for them in childhood.

That's not a permanent condition. It can",en,2026732365230530641,['2026732372209877441'],2026-02-25T18:53:47.000Z,2026732372209877441,1,1,3,0,0,368,,18027434,drmarkhyman
"The ACE (Adverse Childhood Experiences) study backs this up. It found that childhood stress — from abuse to emotional neglect to a parent dealing with addiction — predicts higher rates of heart disease, diabetes, cancer, and mental health conditions decades later.

The body keeps",en,2026732365230530641,['2026732370397901114'],2026-02-25T18:53:46.000Z,2026732370397901114,1,1,3,1,0,412,,18027434,drmarkhyman
"The reason, she argues, is that a lot of what drives our behavior isn't stored in our thoughts. It's stored in the body — in how our nervous system learned to create safety in childhood.

Your heart rate, your breathing, your muscle tension. That's where the old patterns live.",en,2026732365230530641,['2026732368711790919'],2026-02-25T18:53:46.000Z,2026732368711790919,1,2,21,0,7,2244,,18027434,drmarkhyman
"Most mental health models focus on insight — understand your patterns, change your thoughts, change your behavior.

The problem Dr. LePera identified in her own practice: clients would understand their patterns completely and still repeat them. Insight alone wasn't moving the",en,2026732365230530641,['2026732367000514771'],2026-02-25T18:53:45.000Z,2026732367000514771,0,1,14,0,2,2772,,18027434,drmarkhyman
"I've done years of therapy. I understand my patterns. I know where they came from. And yet saying no to something simple can still trigger a real physiological response in me.

That gap between knowing and changing is exactly what @Theholisticpsyc's new book is about. 🧵",en,2026732365230530641,['2026732365230530641'],2026-02-25T18:53:45.000Z,2026732365230530641,6,6,42,1,25,8160,,,drmarkhyman
"Caregivers, parents, grandparents — what confuses you most about kids and food today? School snacks, ultra-processed foods, supplements, growth, behavior, immunity?

I’m answering your questions in an upcoming AMA on children’s nutrition.

Ask away: https://t.co/FXbpSuXYEg",en,2024883342689390796,['2024883342689390796'],2026-02-20T16:26:24.000Z,2024883342689390796,6,13,27,0,3,4664,,,drmarkhyman
"Food Fix Uncensored becoming a New York Times Bestseller is incredible.

But what means the most to me is who this book was written for.

It was written for you.

For the parents trying to raise healthy kids in a world flooded with ultra-processed food.
For the patients who feel https://t.co/uzxflx66Ax",en,2024631440412135616,['2024631440412135616'],2026-02-19T23:45:25.000Z,2024631440412135616,13,11,150,1,11,8934,,,drmarkhyman
"This week felt historic to me. Abe Sutton the Deputy Administrator of the Centers for Medicare &amp; Medicaid Services (CMS) and Director of the Center for Medicare &amp; Medicaid Innovation (CMMI), the federal agency and research arm that tests new payment and care delivery models for https://t.co/Plvo4a59Qm",en,2024517826581844382,['2024517826581844382'],2026-02-19T16:13:58.000Z,2024517826581844382,14,18,148,3,19,8589,,,drmarkhyman
"This drink, shared by a Starbucks employee, has over 7 million views on TikTok. This is what I call “feel like crap syndrome” in a cup.

We wonder why so many people wake up tired, anxious, foggy, and hungry two hours after breakfast. Then we start the day with the metabolic https://t.co/CEP0k08vHE",en,2023880412653908234,['2023880412653908234'],2026-02-17T22:01:06.000Z,2023880412653908234,15,34,166,6,25,23510,,,drmarkhyman
"What you can do starting today.

-Cook more at home—even simple whole food meals are dramatically better
- Crowd out UPFs with vegetables, fruits, legumes, nuts, seeds, and quality proteins
- Swap packaged snacks for hard-boiled eggs, raw nuts, or fresh fruit
- Focus on what",en,2023875604828086778,['2023875611484450974'],2026-02-17T21:42:02.000Z,2023875611484450974,1,5,18,0,6,2205,,18027434,drmarkhyman
"What this national analysis found:

 • Higher ultra-processed food intake was associated with higher cardiovascular disease risk
 • Adults in the highest intake group had a 47% higher relative risk of heart attack or stroke

Diets high in ultra-processed foods are consistently",en,2023875604828086778,['2023875609735352685'],2026-02-17T21:42:01.000Z,2023875609735352685,1,2,11,0,1,2324,,18027434,drmarkhyman
"What counts as ultra-processed?

In this study, foods were classified using the validated NOVA system, which defines ultra-processed foods as industrial products made with refined ingredients and additives.

Common examples include:
- Sodas and sweetened beverages
- Packaged",en,2023875604828086778,['2023875608170951112'],2026-02-17T21:42:01.000Z,2023875608170951112,5,3,50,0,4,5714,,18027434,drmarkhyman
"Researchers from Florida Atlantic University analyzed nearly 5,000 U.S. adults and found:

- The average participant got 26% of their daily calories from ultra-processed foods
- Those in the highest quartile of ultra-processed food intake had a 47% higher relative risk of heart",en,2023875604828086778,['2023875606677729413'],2026-02-17T21:42:01.000Z,2023875606677729413,2,7,44,1,1,5885,,18027434,drmarkhyman
A new U.S. study found that adults who eat the most ultra-processed foods face a 47% higher risk of heart attack or stroke… 🧵,en,2023875604828086778,['2023875604828086778'],2026-02-17T21:42:00.000Z,2023875604828086778,33,22,236,3,28,15295,,,drmarkhyman
"After 10 years of lawsuits and public pressure, Corteva is finally discontinuing Enlist Duo, a weedkiller that combined glyphosate with 2,4-D, a chemical used in Agent Orange...

Turns out “possible carcinogen” doesn’t pair well with corn and soy. https://t.co/ztBoQxW4Hz",en,2023517957985554599,['2023517957985554599'],2026-02-16T22:00:50.000Z,2023517957985554599,44,8,240,3,17,20997,,,drmarkhyman
