created_at,text,id,lang,conversation_id,edit_history_tweet_ids,public_metrics.retweet_count,public_metrics.reply_count,public_metrics.like_count,public_metrics.quote_count,public_metrics.bookmark_count,public_metrics.impression_count,username
2026-04-10T23:04:00.000Z,My keynote talk at Bioneers has been posted https://t.co/G6PLiv6eOs,2042740410775126508,en,2042740410775126508,['2042740410775126508'],4,0,28,0,7,2658,michaelpollan
2026-04-10T12:42:35.000Z,"Michael Pollan on consciousness, psychedelics, and his new book A World Appears | The Standard https://t.co/sTGvuUhLBw",2042584025764684135,en,2042584025764684135,['2042584025764684135'],3,0,43,1,7,3107,michaelpollan
2026-04-09T16:52:02.000Z,"Michael Pollan on Consciousness, Psychedelics and the Fight for Free Thought - YouTube https://t.co/jseMm4jpPw",2042284413166170603,en,2042284413166170603,['2042284413166170603'],0,0,13,0,8,3920,michaelpollan
2026-04-09T16:51:34.000Z,"Michael Pollan on Consciousness, Psychedelics and the Fight for Free Thought - Brave New World | Podcast on Spotify https://t.co/p2KwPodcCM",2042284295390163001,en,2042284295390163001,['2042284295390163001'],3,0,40,1,7,3562,michaelpollan
2026-04-09T16:50:21.000Z,"Michael Pollan on consciousness, psychedelics, and his new book A World Appears | The Standard https://t.co/sTGvuUhLBw",2042283988379664799,en,2042283988379664799,['2042283988379664799'],6,6,81,1,17,5746,michaelpollan
2026-04-08T12:43:00.000Z,An episode of Altered States was nominated for a Webby Awards: https://t.co/d6PMM8kuVK,2041859354232594472,en,2041859354232594472,['2041859354232594472'],1,1,14,0,2,2932,michaelpollan
2026-04-08T12:26:56.000Z,How Psychedelics Affect the Brain - The New York Times https://t.co/y5vPOEHrng,2041855310675993075,en,2041855310675993075,['2041855310675993075'],37,6,210,2,106,21105,michaelpollan
2026-04-06T15:48:01.000Z,Excerpt from the novel Carne de Dios - by Chloe Garcia Roberts - in The Microdose https://t.co/ct8XazA3mn,2041181138916462820,en,2041181138916462820,['2041181138916462820'],0,0,2,0,2,2665,michaelpollan
2026-04-02T18:49:55.000Z,Mind-blowing science: Complete biosynthesis of psychedelic tryptamines from three kingdoms in plants | Science Advances https://t.co/39mQdp1cFE,2039777364339773790,en,2039777364339773790,['2039777364339773790'],21,7,153,1,91,14901,michaelpollan
2026-04-02T18:31:44.000Z,Tonight! BCNARTS: Best Bets: Michael Pollan Speaks About 'A World Appears' In San Rafael https://t.co/0S1ToW6BtL,2039772789528465692,en,2039772789528465692,['2039772789528465692'],0,0,8,0,0,2872,michaelpollan
2026-04-01T16:23:34.000Z,Michael Pollan Returns (on con… - Armchair Expert with Dax Shepard - Apple Podcasts https://t.co/dP2Funh2eB,2039378145720336892,en,2039378145720336892,['2039378145720336892'],1,1,16,0,0,2345,michaelpollan
2026-03-31T18:59:54.000Z,Opinion | Michael Pollan’s Journey to the Borderlands of Consciousness - The New York Times https://t.co/seUEos1s6e,2039055101860651391,en,2039055101860651391,['2039055101860651391'],6,4,47,4,9,7810,michaelpollan
2026-03-30T17:35:46.000Z,This is an important argument coming from someone with the authority to make it. https://t.co/NG7u8JpPoO,2038671538136961148,en,2038671538136961148,['2038671538136961148'],4,2,40,0,15,22350,michaelpollan
2026-03-29T20:40:16.000Z,"Congratulations to the 2026 Ferriss-UC Berkeley Psychedelic Journalism fellows! In a very competitive pool, these journalists and their stories stood out for their originality and importance.
https://t.co/H9rC00cSHz",2038355584433676675,en,2038355584433676675,['2038355584433676675'],3,1,21,1,1,3942,michaelpollan
2026-03-27T22:56:48.000Z,Robin Carhart-Harris Is Mapping the Mind Using Psychedelics | DoubleBlind Mag https://t.co/QNav8g09Fb,2037665165387162073,en,2037665165387162073,['2037665165387162073'],17,5,104,2,25,7273,michaelpollan
2026-03-24T13:24:21.000Z,Project Mind Control: 5 Questions with historian John Lisle https://t.co/hivRT1AwxV,2036433941360414882,en,2036433941360414882,['2036433941360414882'],3,2,10,0,2,3464,michaelpollan
2026-03-24T12:24:32.000Z,https://t.co/IhNrnpizF8 via @NYTimes,2036418890171838677,zxx,2036418890171838677,['2036418890171838677'],13,3,71,4,29,42262,michaelpollan
2026-03-22T17:39:28.000Z,"Thanks for a great and enlighten evening, @anilkseth https://t.co/xdYP28hG6c",2035773368683606153,en,2035773368683606153,['2035773368683606153'],0,1,17,0,1,5893,michaelpollan
2026-03-22T10:42:08.000Z,Corn Belt Confidential on Glyphosate https://t.co/L5KMl3vUOe,2035668341088501954,en,2035668341088501954,['2035668341088501954'],2,0,9,0,2,3877,michaelpollan
2026-03-20T17:40:35.000Z,https://t.co/mNeHL141IL,2035048875447243021,zxx,2035048875447243021,['2035048875447243021'],1,1,7,0,3,3229,michaelpollan
2026-03-20T09:24:03.000Z,"For the Same Cost as Another Mideast War, We Could Make Oil Irrelevant | The New Republic https://t.co/DZTebQDGDF",2034923918834954249,en,2034923918834954249,['2034923918834954249'],13,8,33,1,4,3881,michaelpollan
2026-03-16T16:21:26.000Z,"Dolphins, LSD, and floating tanks : 5 Questions for filmmaker Courtney Stephens https://t.co/EMTnKBLrnU",2033579401808339090,en,2033579401808339090,['2033579401808339090'],5,5,43,2,14,7380,michaelpollan
2026-03-15T14:53:39.000Z,Psilocybin seems to help tobacco smokers quit; Scientists discover a new species of psychedelic mushroom in Africa https://t.co/E5d2aUHoUQ,2033194925299302418,en,2033194925299302418,['2033194925299302418'],26,7,236,0,33,18441,michaelpollan
2026-03-15T14:48:17.000Z,"How do you break psychedelic molecules into parts, like cars in a chop shop, and build new ones? A look into non-psychedelic psychedelic medicine by Clayton Dalton, an ER doc and Ferriss-UC Berkeley Psychedelic Journalism Fellow @ucbsoj &amp; @SciPsychedelics https://t.co/b7R4aTNdyf",2033193573659590910,en,2033193573659590910,['2033193573659590910'],11,2,71,2,27,6227,michaelpollan
2026-03-13T03:28:50.000Z,Congratulations Haleema! https://t.co/jFRGdQzY8u,2032297807055380831,en,2032297807055380831,['2032297807055380831'],3,1,43,0,18,9044,michaelpollan
2026-03-13T02:28:27.000Z,Why the Kids Won’t Farm https://t.co/EkueIGiZnY via @NYTOpinion,2032282611511329215,en,2032282611511329215,['2032282611511329215'],8,1,35,0,18,6842,michaelpollan
2026-03-12T18:37:23.000Z,Just dropped: My appearance on The Joe Rogan Experience | Podcast on Spotify https://t.co/tO4mbAXD7v,2032164065905426552,en,2032164065905426552,['2032164065905426552'],15,24,311,2,30,17834,michaelpollan
2026-03-09T16:50:22.000Z,(1) Will the FDA ever fast-track psychedelic drugs? 5 Questions with drug regulation expert Daniel Eisenkraft Klein https://t.co/EG82pS0en5,2031049970628047063,en,2031049970628047063,['2031049970628047063'],10,1,37,0,8,6648,michaelpollan
2026-03-07T23:18:37.000Z,This post by Tom Shroder and Gemini is spooky. https://t.co/62KhxTeDus,2030422899904192743,en,2030422899904192743,['2030422899904192743'],1,3,19,0,30,9704,michaelpollan
2026-03-06T18:35:45.000Z,Michael Pollan explains why AI will never replicate human consciousness | Scientific American https://t.co/rQ1VzF7vQs,2029989324637491439,en,2029989324637491439,['2029989324637491439'],76,58,271,8,154,25908,michaelpollan
2026-03-06T17:32:15.000Z,https://t.co/hnZYw9JJZy,2029973346818081271,zxx,2029973346818081271,['2029973346818081271'],5,8,116,2,25,8751,michaelpollan
2026-03-06T16:40:15.000Z,AtaiBeckley’s MDMA product could treat social anxiety; HHS Secretary Kennedy talks psychedelics on Rogan podcast; WV Senate and SD legislature pass Compass trigger bills https://t.co/ZSLSUJJNyt,2029960258794455529,en,2029960258794455529,['2029960258794455529'],17,2,90,1,17,7699,michaelpollan
2026-03-05T21:23:30.000Z,"‘Our consciousness is under siege’: Michael Pollan on chatbots, social media and mental freedom | Well actually | The Guardian https://t.co/xC1394asGX",2029669155528749438,en,2029669155528749438,['2029669155528749438'],87,7,330,4,184,41590,michaelpollan
2026-03-02T23:00:04.000Z,My interview with Dan Harris: How to Stop Ruminating and Reclaim Your Mind | Michael Pollan - YouTube https://t.co/vbfINclKEy,2028606292735271269,en,2028606292735271269,['2028606292735271269'],13,4,111,0,87,15250,michaelpollan
2026-03-02T16:58:34.000Z,A new excerpt from A World Appears: Minds Before Brains - by Michael Pollan - The Microdose https://t.co/mimrefsOW7,2028515320005349747,en,2028515320005349747,['2028515320005349747'],3,0,16,0,2,3524,michaelpollan
2026-03-01T16:53:48.000Z,Interested in consciousness? Check out the new resources page on my website. Lots of goodies and backstory on the book - https://t.co/tJHy1pr2ZT,2028151730941362203,en,2028151730941362203,['2028151730941362203'],6,2,45,0,22,6148,michaelpollan
2026-02-28T19:13:34.000Z,"Penguin Press founder Ann Godoff, a powerhouse editor of bestsellers and prize winners, dies at 76 - The Washington Post https://t.co/ccuGwOTEIM",2027824515229561254,en,2027824515229561254,['2027824515229561254'],1,0,23,0,1,4395,michaelpollan
2026-02-27T20:46:48.000Z,There are still tickets available for my LA event with @booksoup with @susanorlean on March 5. Tickets here: https://t.co/TdDjTKLx7y https://t.co/IODb4gibad,2027485592372564014,en,2027485592372564014,['2027485592372564014'],1,1,11,0,0,2823,michaelpollan
2026-02-27T20:22:47.000Z,"Book Review: ‘A World Appears,’ by Michael Pollan - The New York Times https://t.co/Qkjwex5A1y",2027479546547601701,en,2027479546547601701,['2027479546547601701'],5,2,41,0,8,4302,michaelpollan
2026-02-27T20:21:47.000Z,My podcast with Andrew Sullivan: Michael Pollan On The Mystery Of Consciousness https://t.co/mSCnmOQld4,2027479296965554519,en,2027479296965554519,['2027479296965554519'],1,1,19,0,8,3493,michaelpollan
2026-02-27T20:04:18.000Z,The FDA is changing the drug approval process; Surgeon General nominee Casey Means asked about psychedelics https://t.co/MTGx14WcVc,2027474894716379443,en,2027474894716379443,['2027474894716379443'],12,3,69,2,13,7852,michaelpollan
2026-02-26T17:48:05.000Z,Ann edited all ten of my books. I can't imagine writing one without her wisdom and support. https://t.co/3r5BywBJOg,2027078228347613649,en,2027078228347613649,['2027078228347613649'],14,6,227,1,6,18896,michaelpollan
2026-02-26T17:46:46.000Z,How Michael Pollan Expanded His Consciousness | The New Yorker https://t.co/KOjfhklcCQ,2027077895768637481,en,2027077895768637481,['2027077895768637481'],8,3,69,1,45,7733,michaelpollan
2026-02-24T13:36:34.000Z,Michael Pollan's New Book Pops the AI Bubble - The Atlantic https://t.co/VH45nHt6AC,2026290156932628543,en,2026290156932628543,['2026290156932628543'],32,20,207,3,121,21029,michaelpollan
2026-02-24T13:26:04.000Z,"Michael Pollan’s new book, ‘A World Appears,’ explores the mystery of consciousness - Los Angeles Times https://t.co/WaHPOfIcou",2026287512184852734,en,2026287512184852734,['2026287512184852734'],13,5,112,1,32,7056,michaelpollan
2026-02-23T17:18:41.000Z,"Join us for what promises to be a lively event: Jorie Graham with Michael Pollan: Killing Spree | 92nd Street Y, New York https://t.co/20MBhFtglM",2025983665251951037,en,2025983665251951037,['2025983665251951037'],0,0,6,0,0,3140,michaelpollan
2026-02-23T16:31:59.000Z,What should you listen to while tripping?: 5 Questions with auditory neuroscientist Nikolas Francis https://t.co/p0boGApmwH,2025971914598924688,en,2025971914598924688,['2025971914598924688'],6,11,48,1,39,9427,michaelpollan
2026-02-23T15:58:47.000Z,Join me at my DC event on Friday! https://t.co/Kkk5mDSoX0,2025963558870057370,en,2025963558870057370,['2025963558870057370'],0,0,11,0,0,4194,michaelpollan
2026-02-21T21:14:35.000Z,The Mythology Of Conscious AI https://t.co/Kh660F8lmk,2025318255787729033,en,2025318255787729033,['2025318255787729033'],22,14,127,3,82,11256,michaelpollan
2026-02-21T19:32:54.000Z,Michael Pollan: Mushroom trip made me wonder if bots have a sense of self https://t.co/tDrmfOfd9s,2025292667404292507,en,2025292667404292507,['2025292667404292507'],13,17,132,7,40,13773,michaelpollan
2026-02-20T23:33:03.000Z,https://t.co/rfpnfZmpUT,2024990714723967313,zxx,2024990714723967313,['2024990714723967313'],12,5,61,4,18,56666,michaelpollan
2026-02-20T19:43:27.000Z,MAHA Moms Turn Against Trump: ‘Women Feel Like They Were Lied To’ - The New York Times https://t.co/rW9EjM2Vyt,2024932931727179910,en,2024932931727179910,['2024932931727179910'],23,19,96,2,7,11402,michaelpollan
2026-02-20T18:21:03.000Z,Michael Pollan explores AI and consciousness in 'A World Appears' : NPR https://t.co/TyKL0nxnyl,2024912197344784538,en,2024912197344784538,['2024912197344784538'],5,14,62,0,16,6108,michaelpollan
2026-02-20T18:18:17.000Z,"Compass announces promising yet modest results from second Phase 3 psilocybin trial; Missouri hearings on ibogaine and psilocybin bills, New Hampshire psilocybin bill advances https://t.co/Tx2ES6KxX9",2024911502013067760,en,2024911502013067760,['2024911502013067760'],1,2,38,0,4,3535,michaelpollan
2026-02-20T13:30:14.000Z,My appearance on Fresh Air yesterday: Michael Pollan explores AI and consciousness in 'A World Appears' : NPR https://t.co/TyKL0nxnyl,2024839012230345204,en,2024839012230345204,['2024839012230345204'],5,2,54,1,11,4884,michaelpollan
2026-02-19T16:01:48.000Z,Important essay: Why organisms are more than machines - Big Think https://t.co/llV11x4Gtz,2024514767562354977,en,2024514767562354977,['2024514767562354977'],63,14,278,6,197,27439,michaelpollan
2026-02-19T15:43:35.000Z,The Power of Perennial Agriculture | Civil Eats https://t.co/oN21B5ltJU,2024510179925012869,en,2024510179925012869,['2024510179925012869'],6,1,27,1,8,6045,michaelpollan
2026-02-19T13:36:33.000Z,Excerpt from “A World Appears” in the Guardian https://t.co/A0eKspItfr,2024478212001026423,en,2024478212001026423,['2024478212001026423'],12,2,37,0,7,11397,michaelpollan
2026-02-19T00:01:28.000Z,My magic mushroom-fuelled journey in search of consciousness https://t.co/VMgnOmpWqO,2024273091182944621,en,2024273091182944621,['2024273091182944621'],38,19,363,4,229,26520,michaelpollan
2026-02-18T23:55:14.000Z,Food reform was always a Democrat issue. Then RFK Jr. and MAHA hijacked it. | Food and Environment Reporting Network https://t.co/WZ3pnNDmjv,2024271519958856125,en,2024271519958856125,['2024271519958856125'],3,95,60,9,8,27101,michaelpollan
2026-02-18T01:20:21.000Z,Sugar Prices Just Hit a 5-Year Low due to weight loss https://t.co/tThcB3Yf3F,2023930554383823339,en,2023930554383823339,['2023930554383823339'],6,2,29,1,2,5211,michaelpollan
2026-02-17T17:41:50.000Z,"This book, out today, is inspiring. Tiny Gardens Everywhere a book by Kate Brown - https://t.co/MHGv0rDREX US https://t.co/Bw5KuJkLpm",2023815165997969439,en,2023815165997969439,['2023815165997969439'],8,2,29,2,6,3982,michaelpollan
2026-02-16T20:13:38.000Z,A World Appears by Michael Pollan review – a kaleidoscopic exploration of consciousness | Science and nature books | The Guardian https://t.co/NQVt8supUH,2023490976451555540,en,2023490976451555540,['2023490976451555540'],17,2,116,0,36,19985,michaelpollan
2026-02-15T23:31:22.000Z,"I'm looking forward to reading Allan Savory's memoir, just out: UnSavory: African Stories of Wildlife, War, and the Birth of Holistic Management eBook : Kindle Store https://t.co/9JhehB4m3a",2023178349502407021,en,2023178349502407021,['2023178349502407021'],2,1,26,0,5,4570,michaelpollan
2026-02-15T18:09:07.000Z,Food Used to Be Democrats’ Territory. What Happened? | The New Republic https://t.co/sH42Md07eO,2023097254765265338,en,2023097254765265338,['2023097254765265338'],9,26,44,1,8,8790,michaelpollan
2026-02-13T17:55:09.000Z,"(36) A bonanza of new state psychedelics bills, including ones to fund ibogaine research and new trigger laws for synthetic psilocybin https://t.co/tbYEu5WMj0",2022368965385949342,en,2022368965385949342,['2022368965385949342'],4,5,48,0,5,4690,michaelpollan
2026-02-11T20:02:09.000Z,First review of my new book in the FT: John Banville on A World Appears by Michael Pollan — what is consciousness? - Michael Pollan https://t.co/oQE3YLx8FD,2021676149848633846,en,2021676149848633846,['2021676149848633846'],2,5,24,1,3,4566,michaelpollan
2026-02-11T02:15:38.000Z,A.I. Can Fool Us Into Thinking It’s Human. Now What? - The New York Times https://t.co/vWRwyiaase,2021407751109476646,en,2021407751109476646,['2021407751109476646'],5,4,32,0,9,5046,michaelpollan
2026-02-11T02:12:35.000Z,Michael Pollan on R.F.K. Jr. and the MAHA Movement - The New York Times https://t.co/FG1T88GzPM,2021406985057669453,en,2021406985057669453,['2021406985057669453'],7,15,38,1,34,12115,michaelpollan
2026-02-09T22:22:18.000Z,My new interview with the NY Times. https://t.co/oT1rO4YV53,2020986645097611515,en,2020986645097611515,['2020986645097611515'],7,9,78,0,13,20263,michaelpollan
2026-02-09T18:06:07.000Z,"If you can’t attend one of my book events in person, you can register for the Livestream of my @bnbuzz New York event. Ticket includes a book. https://t.co/zAlB9Mf5Wr",2020922174283104538,en,2020922174283104538,['2020922174283104538'],3,1,20,0,2,6086,michaelpollan
2026-02-08T22:56:54.000Z,"Tour for ""A World Appears"" Begins in New York on Feb 24, then Cambridge, DC, Portland, Seattle, SF and LA. Hope to see you at one of these events. https://t.co/AYzDRusux9",2020632961914441870,en,2020632961914441870,['2020632961914441870'],1,1,16,0,2,4046,michaelpollan
2026-02-08T22:23:54.000Z,An Intimate Afternoon aboard a Sausalito Houseboat with Dr. Leor Roseman and Joy Sela discussing Psychedelics and Peacebuilding · Luma https://t.co/o1bHXNfCry,2020624656508887235,en,2020624656508887235,['2020624656508887235'],2,1,18,0,4,4106,michaelpollan
2026-02-08T22:03:25.000Z,‘I’m the psychedelic confessor’: the man who turned a generation on to hallucinogens returns with a head-spinning book about consciousness | Books | The Guardian https://t.co/6Dt3FpyJh5,2020619501876945216,en,2020619501876945216,['2020619501876945216'],62,34,567,5,326,96358,michaelpollan
2026-02-07T20:03:53.000Z,Join me March 1 for the screening of “John Lilly and the Earth Coincidence Control Office” at @BAMPFA. I’ll be in convo with the filmmaker after the movie. This is opening day for the @scipsychedelics film series. Tickets on sale now at https://t.co/VE5RWDlmny,2020227032584802362,en,2020227032584802362,['2020227032584802362'],3,2,16,0,4,4222,michaelpollan
2026-02-05T22:41:39.000Z,In SF on Saturday? Judith Belzer: Weather Report - Opening Reception @ Hosfelt Gallery — art bae https://t.co/V7zsPjYAEe,2019541962555289629,en,2019541962555289629,['2019541962555289629'],0,1,7,0,1,2889,michaelpollan
2026-02-05T17:38:21.000Z,Bet you didn't know this about me. Either did I! https://t.co/W0IkDXn9hT,2019465634636050578,en,2019465634636050578,['2019465634636050578'],14,10,65,1,3,8969,michaelpollan
2026-02-02T18:03:04.000Z,Psychedelic narcissism: 5 Questions for medical psychologist Henrik Jungaberle https://t.co/1w1v1Krwl3,2018384688487002225,de,2018384688487002225,['2018384688487002225'],3,1,19,1,9,5607,michaelpollan
2026-02-02T17:57:45.000Z,A Journey into Consciousness: Live discussion with Michael Pollan April 14 · Dandelion https://t.co/520n9PAVLR,2018383351271625009,en,2018383351271625009,['2018383351271625009'],1,1,21,0,3,3131,michaelpollan
2026-01-30T17:39:15.000Z,Ibogaine consortium gains steam with new bills in MS and OK; Federal psychedelics efforts remain stagnant https://t.co/KVdoleMlFJ,2017291531703779472,en,2017291531703779472,['2017291531703779472'],0,7,20,0,3,3571,michaelpollan
2026-01-29T22:18:02.000Z,"IN the Bay Area? This should be good: A Public Defender’s Search for Justice, with Emily Galvin Almanza https://t.co/aA25npXSOv",2016999303789846876,en,2016999303789846876,['2016999303789846876'],4,1,14,0,3,4756,michaelpollan
2026-01-29T18:11:02.000Z,"A deep dive into psychedelic churches, Oakland's Zide Door, and what makes a religion a religion in America from @horowitzghazi, a host and reporter at Planet Money and 2025 Ferriss-UC Berkeley Psychedelic Journalism Fellow at @ucbsoj &amp; @SciPsychedelics
https://t.co/znhfHX90rY",2016937142371618876,en,2016937142371618876,['2016937142371618876'],8,3,77,0,25,8141,michaelpollan
2026-01-28T22:45:07.000Z,About Those Dietary Guidelines … | The Bittman Project https://t.co/hxOniwNAtL?,2016643731546615820,en,2016643731546615820,['2016643731546615820'],5,51,22,6,24,78620,michaelpollan
2026-01-28T22:22:17.000Z,In Seattle? This event promises to be a lot of fun. Michael Pollan with Jon Mooallem https://t.co/2AWmLO2fCj,2016637985857687843,en,2016637985857687843,['2016637985857687843'],0,0,8,0,0,4912,michaelpollan
2026-01-28T00:52:22.000Z,"First US paraquat trial to start this week, examining links between the pesticide and Parkinson’s disease - The New Lede https://t.co/dVQVP5nZrA",2016313365757612379,en,2016313365757612379,['2016313365757612379'],3,0,20,0,3,3947,michaelpollan
2026-01-27T22:56:12.000Z,"Important paper calling out industry on ""Better-for-you"" ultra-processed foods: https://t.co/pKxgfhOBzb",2016284130598912478,en,2016284130598912478,['2016284130598912478'],7,6,56,1,7,11098,michaelpollan
2026-01-27T00:23:51.000Z,"Interesting story: Black Swans, Processed Food, and Eugenics in the Blue Ridge | fieldquestions https://t.co/6WFlDOoKo0",2015943803237236818,en,2015943803237236818,['2015943803237236818'],1,1,17,0,16,5158,michaelpollan
2026-01-26T19:05:05.000Z,The Untold Story of Women Psychedelic Therapists: 5 Questions with historian Zoë Dubus https://t.co/ZubHMUzDJT,2015863581699670452,en,2015863581699670452,['2015863581699670452'],1,0,12,0,5,3524,michaelpollan
2026-01-26T17:41:08.000Z,"First excerpt from my new book, A World Appears: How to Have a ‘Don’t-Know Mind’ - The Atlantic https://t.co/IeMytDkEIN",2015842454453547301,en,2015842454453547301,['2015842454453547301'],21,5,139,1,59,14679,michaelpollan
2026-01-23T17:56:45.000Z,RAND estimates millions of Americans microdosed psychedelics in 2025; New Jersey to commit $6 million to psilocybin research; new bills in New Hampshire and Iowa https://t.co/zDOJPRCl51,2014759221456470284,en,2014759221456470284,['2014759221456470284'],4,1,21,0,1,4168,michaelpollan
2026-01-22T23:23:30.000Z,The NYT's Pro-Big Ag Pundit Gets It Right on Manure - But Misses the Mark on Herbicides - - Johns Hopkins Center for a Livable Future https://t.co/YQegXnle7a,2014479064829182221,en,2014479064829182221,['2014479064829182221'],3,3,18,2,1,11457,michaelpollan
2026-01-22T21:14:00.000Z,RFK Jr. dietary guidelines: What American food pyramid can do better https://t.co/gkkRG0vFdl,2014446474797645827,en,2014446474797645827,['2014446474797645827'],1,2,10,0,4,4709,michaelpollan
2026-01-22T18:03:32.000Z,Food Systems and Public Health Fellowship for Journalists - - Johns Hopkins Center for a Livable Future https://t.co/nMi5MnDpJL,2014398541121388656,en,2014398541121388656,['2014398541121388656'],3,2,9,1,1,2814,michaelpollan
2026-01-22T17:47:16.000Z,I'll be at this event in March: Breaking Point: Telesummit on Psychedelic Healing https://t.co/Hi4BC58hk2,2014394447329739198,en,2014394447329739198,['2014394447329739198'],0,0,8,0,2,2359,michaelpollan
2026-01-20T20:33:51.000Z,"📷 Congrats to our 2nd cohort of Mycoskie–UC Berkeley Psychedelic Documentary Fellows!

📷 Prod &amp; Post: Alexandra Roca, Otilia Padua, Will Wertz
📷 R&amp;D: Ewan Waddell, Jia Li, Julia Ngeow 
📷 Student: Claire Crawford (UCLA)
📷 https://t.co/8JJnkSHoki https://t.co/3jbNKjYBpj",2013711593176256786,en,2013711593176256786,['2013711593176256786'],2,7,9,0,0,3302,michaelpollan
2026-01-20T02:46:28.000Z,https://t.co/6uN76VtbvC via @NYTimes,2013442976295592368,zxx,2013442976295592368,['2013442976295592368'],2,0,17,1,5,4316,michaelpollan
2026-01-16T17:06:26.000Z,New psychedelic legislative efforts in WA; NJ bill passes; MindMed and Cybin rebranding https://t.co/EPkuNdhgHM,2012209842866278574,en,2012209842866278574,['2012209842866278574'],3,1,28,1,1,5108,michaelpollan
2026-01-16T01:29:48.000Z,"Congratulations to Toby Kiers, World Champion of Mycorrhizal Fungus - The New York Times https://t.co/SgevPKDosg",2011974131219403226,en,2011974131219403226,['2011974131219403226'],1,2,13,0,2,4481,michaelpollan
2026-01-14T22:52:27.000Z,"JOURNALISTS! Apply for $10K award to report in-depth print and audio stories on psychedelics. The Ferriss – UC Berkeley Psychedelic Journalism Fellowship application is open now and due 1/31, from @ucbsoj x @SciPsychedelics. Apply here https://t.co/n2deGH97wG",2011572147525992646,en,2011572147525992646,['2011572147525992646'],7,5,27,1,4,5521,michaelpollan
2026-01-13T18:36:43.000Z,Excited to announce my upcoming book tour for A World Appears: A Journey into Consciousness. For details and tickets: https://t.co/bbuNteOHgy https://t.co/Fvk7jpt3nv,2011145399336333375,en,2011145399336333375,['2011145399336333375'],1,2,31,0,2,4398,michaelpollan
